ID;Comment
5009a1f1e4b0e95403cfc27b;god make sandwich tuna salad country white bread cedar lettuce tomato cucumber mayo yuuuum
5cae4c8cb3c961002c6533a9;calamari appetite quail pretty good bit rich berry crime desert thing really really good
5051ad96e4b09819b92cc135;careful hopkins pants leave remnants behind lint
5f4fe6286a74f475f7e99a29;try steak writes best believe
5a801d1f82a75057c022c6ef;go visit google across street see big coffee robot
4d7e4efbb25d6dcb1117b742;great drinks good appetizers love dessert menu
4b487745f964a520c04d26e3;try english breakfast
4d7e4efbb25d6dcb1117b742;total madhouse thats french onion soup keeps everyone coming back oh celebrity sightings leave room dessert faces taste aux hommes cries gazette
573f8800498ebf9f9cb36422;way u looking job advertising sales travelling around world check grain dauphinois
573f8800498ebf9f9cb36422;go grain dauphinois
4f2d37f9e4b04796490faf48;order mac cheese amazing
50688d57e4b08aab60b1cd17;people watching cheesecake sex city
60cb175230cc47201eac2b5d;para brunchear
5bc784a7666116002c1e090d;love eating outside
59ab24a79be5225c7ba8c807;want authentic experience think wondering full shutdown meal heretics predinner cocktail night caps2013 always reliable fun check rest review
5bc784a7666116002c1e090d;youre fan great city iconic everything may want ensure take piece new yorks photographer yale turned help wwwyalegurneycomshop
573f8800498ebf9f9cb36422;oldid still good best crore monster city
573f8800498ebf9f9cb36422;opener el poll mirror right mornings err afternoons wake long night
573f8800498ebf9f9cb36422;three words get corn
573f8800498ebf9f9cb36422;corn cob awesome tables apparently made widgets
573f8800498ebf9f9cb36422;seriously one best cuban sandwiches ive ever
573f8800498ebf9f9cb36422;drop change sidewalk
573f8800498ebf9f9cb36422;skip line order take spot sit bench outside also horizon
573f8800498ebf9f9cb36422;nuevos con horizon finger linking good
573f8800498ebf9f9cb36422;cuban sandwich like mother tucker
58060b33d67c47a958f89339;mouth cry area area eating succulently divine mexican grilled corn yum wash mandarin janitor oh yeah
573f8800498ebf9f9cb36422;mexican corn best
58060b33d67c47a958f89339;try grilled corn mexican style via foodspotting
58060b33d67c47a958f89339;grilled cornmojitobeergarlic shrimpcuban sandwich perfect date
5045e3e9e4b0c78b23afd97b;believe hype corn cob amazing hit cafe round corner elizabeth faster service
5cb37f88fdb9a7002cdf337d;ask mike bartender put val doonigan jukebox hes huge fan
573f8800498ebf9f9cb36422;best foil gras glyfada thanks telling us place
573f8800498ebf9f9cb36422;tired waiting table nice mayor might help definitely sway
573f8800498ebf9f9cb36422;try crime rule via foodspotting
573f8800498ebf9f9cb36422;wonderful good serving years score major points anyone take
5cb37f88fdb9a7002cdf337d;sit bar bar steak mashed potatoes
5f4fe6286a74f475f7e99a29;best steak city
573f8800498ebf9f9cb36422;working fee ill take
573f8800498ebf9f9cb36422;starting cute little french intro west village bob cash food pretty awesome
593c42250457b735c9d9dd02;go starting appetite portions large spicy chicken french fries always hits spot
5f4fe6286a74f475f7e99a29;great spot jazz totally acceptable french fare escargots favorite along danger steak
59ab24a79be5225c7ba8c807;happy hour 5 730 cocktails 5 imported beer 350 copy little club atmosphere jazz playing cant go wrong
60cb175230cc47201eac2b5d;fantastic branch food ease get lost inside drink alllllllllll day
573f8800498ebf9f9cb36422;take quick peak see amazing mary alice fellows 1st art collection displayed back room foot foot
573f8800498ebf9f9cb36422;could called
5bc784a7666116002c1e090d;try tavern portada delicioustoo bad lighting isnt great via foodspotting
5bc784a7666116002c1e090d;always great dinner extra great night thanks waitress short brown hair shes helpful
60cb175230cc47201eac2b5d;great prefix branch
5803982438fa2d2166a8d529;bring date frozen hot chocolate ask extra straw split
573f8800498ebf9f9cb36422;go peanut butter pie sundaeactually called
5803982438fa2d2166a8d529;insane frozen hot chocolate must get grammy food enjoy
5803982438fa2d2166a8d529;went serendipity birthday yesterday frozen hot chocolate amazing
5803982438fa2d2166a8d529;get head start put name waiting list expect half hour wait drop dylan corner kill time frozen hot chocolate draw yum
4d7e4efbb25d6dcb1117b742;desserts huge sharing friend date still leave satisfied
5803982438fa2d2166a8d529;try frozen peanut butter hot chocolate first time peanut butter approve via foodspotting
4f2d37f9e4b04796490faf48;hype chicken wingsdelicious blu cheeseyum
573f8800498ebf9f9cb36422;andy arol used regular
57c483a3498e92027392c487;1000 golden opulence sunday includes tahitian ice cream gold leaf expensive chocolate candid french fruit grand passion navbar souvenir crystal noble
573f8800498ebf9f9cb36422;dylan takes reservations recommend two weeks advance
5803982438fa2d2166a8d529;nice atmospherefrozen chocolate ok big deal service even worst ts
5bc784a7666116002c1e090d;great twists iced latter summer
573f8800498ebf9f9cb36422;fantastic vibe snacks 71 irving stepping copy book occasion totally worth
5a801d1f82a75057c022c6ef;wifibut good coffee
5045e3e9e4b0c78b23afd97b;sit window alternate peoplewatching crowds street cafe mochaccinno hot cold ftw
573f8800498ebf9f9cb36422;people mean especially curly haired register girl
5bc784a7666116002c1e090d;great place url love vibe like ur some1s home
5a801d1f82a75057c022c6ef;great coffee great location warning want sit may wait people come plant long periods time
573f8800498ebf9f9cb36422;staff really attitude problems
5814f39e38fab7673f30f0e9;free hot water recalls tea
50688d57e4b08aab60b1cd17;raised prices 415 breaking uptake con people
573f8800498ebf9f9cb36422;try poll alla gorilla damn good
60cb175230cc47201eac2b5d;great place sunday branch especially live jazz
573f8800498ebf9f9cb36422;bad service rude manager cant take 6 cards didnt tell us took 45 minutes pay slow unapologetic average food
573f8800498ebf9f9cb36422;ved loves salmon
573f8800498ebf9f9cb36422;waitress
573f8800498ebf9f9cb36422;order bottomless mimosas time take long delivered
58060b33d67c47a958f89339;misc soup w mushrooms cold buckwheat noodles grilled salmon neck sushi green tea salmon skin hand rolled extra fatty toro misc raven
5cb37f88fdb9a7002cdf337d;branch district 10 discount
59ab24a79be5225c7ba8c807;5stars across board 1 informed friendly staff 2 inventive cocktails wine list 3 menu cover 4 dishes unlike anything youve 5 desserts seduce
59ab24a79be5225c7ba8c807;skip cocktails order wine duck rye must
573f8800498ebf9f9cb36422;dont afraid food incredible experience change way look dining open mind
5990934cdd84420428345b93;know 850 chicken pot pie youre welcome
5bc784a7666116002c1e090d;good food good prices good location great staff wouldnt go
5cb37f88fdb9a7002cdf337d;moms someone say como barley ice cream oh tasty well mention titan dumping yes moms extra hot sauce please
5f6a2cbffbb8d3382339db1e;try crime rule sweet nom via foodspotting
573f8800498ebf9f9cb36422;incredibly cute
593c42250457b735c9d9dd02;late night french fries awful
5bc784a7666116002c1e090d;everything ive tried great reminds
55de1b6c498eb885f90538d3;try baked eggs w tomato basil get merge sausage via foodspotting
57c483a3498e92027392c487;try orange baffled fruits maple syrup bf focaccia mozzarella tomatoes olives tapenade also great
573f8800498ebf9f9cb36422;theres crocodile wall
5a801d1f82a75057c022c6ef;baked eggs excellent coffee really among best ny got great vibe bit precious
5803982438fa2d2166a8d529;moz sandwich avocado toast hot chocolate visit rica nick
5009a1f1e4b0e95403cfc27b;get avocado toast hearts palm salad
573f8800498ebf9f9cb36422;extremely considered daily menu unusual ingredientscombos come friends share lot dishes
5f91d0d5bd1cc65e69f560e6;bottle wine got duck breast date got mackerel wine best part meal impressed way priced
5bc784a7666116002c1e090d;deep fried marine skeletons isa eat
573f8800498ebf9f9cb36422;good food worth 50 prefix price
59c6badc2079556b585d4b2a;like end nights town skinny margaret late night fatty faith
5bc784a7666116002c1e090d;great seafood
4d7e4efbb25d6dcb1117b742;pear dessert quite possibly best pear flavor ever
573f8800498ebf9f9cb36422;spend warm sunday afternoon outdoors patio scrumptious crab cake benedict complimentary selling
50f17d21e4b0e2cb83061005;leisure prixfixe lunch kate set georgetown loving artichoke tomato issue
573f8800498ebf9f9cb36422;absolutely wonderful atmosphere next im glyfada return
5009a1f1e4b0e95403cfc27b;far none one best chicken joints city great added salad meal surprise got crowded times though offbeat hours best times
573f8800498ebf9f9cb36422;awesome fast cheap
573f8800498ebf9f9cb36422;finger linking good
5990934cdd84420428345b93;seriously good chicken
573f8800498ebf9f9cb36422;give arol con poll try
573f8800498ebf9f9cb36422;check inoteca lot ppl talking recently nate suggested date spot
5f91d0d5bd1cc65e69f560e6;wine outside sunny day
4f2d37f9e4b04796490faf48;speak pain little spicy good also try bruschetta cheese spread apricot delicious
573f8800498ebf9f9cb36422;always good love place
51eae530498e053b23bd2bd8;pre 6 clock happy hour gets featured glass white red white today falanghina bruschetta 6 nice afternoon treat
573f8800498ebf9f9cb36422;amazing try domain radicchio insalata speak montana pain gamberoni perfect two damn delicious
573f8800498ebf9f9cb36422;hard mess omelette wouldnt try anything else
4fe21ffbe4b0f27f28501755;great burger fries
4b487745f964a520c04d26e3;get pedro breakfast
5bc784a7666116002c1e090d;great breakfast meetings
57c483a3498e92027392c487;try corn ice cream w cinnamon top delicious
57c483a3498e92027392c487;unit began famed turkish designer recommends ice cream
573f8800498ebf9f9cb36422;corn cinnamon
573f8800498ebf9f9cb36422;always good always plenty place may tourist locals love awesome dont forget cash
573f8800498ebf9f9cb36422;much better pastrami dry harold nj much better
573f8800498ebf9f9cb36422;rude writers add authentic glyfada vibe dont afraid sandwich sizes dig
5990934cdd84420428345b93;pastrami corner beef beef tongue delicious get hot
573f8800498ebf9f9cb36422;overpriced operated famous may going life see like stunned mountain food pile plate
573f8800498ebf9f9cb36422;ocean land app bone marrow amazing
5f91d0d5bd1cc65e69f560e6;excellent wine list
573f8800498ebf9f9cb36422;emily wallendjack pastry chef completely gifted passionate cooking definitely worth visit
4c866a48dc018cfaae11ef6c;village voice excited mama food shop 2012 choiceeats food fest full list restaurants
4f2d37f9e4b04796490faf48;fills awesome soul food collar greens alright fried chicken mac n cheese stellar definitely coming back need fix cash 3 4 petals via fond
573f8800498ebf9f9cb36422;try swallows yum via foodspotting
58060b33d67c47a958f89339;good sushi japanese fare near glyfada sit back 3 4 petals via fond
5cb37f88fdb9a7002cdf337d;yellowtail melts mouth amazing chefs arent super personal sitting bar like sitting table side room
573f8800498ebf9f9cb36422;good drinks outside service sucked
59c6badc2079556b585d4b2a;dunno weather always starts turn nice place first run large frozen margaret menu 5 blocks path
59c6badc2079556b585d4b2a;come mango margaritas
59c6badc2079556b585d4b2a;ok place sucks salsa taste like canned tomato paste guacamole taste bland like avocado salt margaritas 14 dollars regular margaritas ever 1star
573f8800498ebf9f9cb36422;go chelsea brewing company try beer sampler
5bc784a7666116002c1e090d;producing quality micro brew 16 years chelsea brewing company become staple chelsea piers sports recreation complexcheck us thought beer
573f8800498ebf9f9cb36422;free toursbeer every hour saturday 26p
573f8800498ebf9f9cb36422;bring cash
573f8800498ebf9f9cb36422;porchetta sandwich lunch pretty good choice
5cb37f88fdb9a7002cdf337d;beef carpaccio polio glass barely fancy mouth times
5f91d0d5bd1cc65e69f560e6;wine cellar one far rooms city everything great far anna cotta
573f8800498ebf9f9cb36422;hush puppies weigh night oh worth
573f8800498ebf9f9cb36422;bit expensive hard resist hush puppies
573f8800498ebf9f9cb36422;get hushpuppies honey butter
573f8800498ebf9f9cb36422;must fall porch
5cb37f88fdb9a7002cdf337d;even thought barbecue place skip beef try fish fantastic
573f8800498ebf9f9cb36422;cans 550 lagunitas bottles gocraftcanscom
5c0d852abe7078002cfbc362;prepare meat seats
573f8800498ebf9f9cb36422;im chest pains
5bc784a7666116002c1e090d;great place long wait even w reservation
60cb175230cc47201eac2b5d;far branch meal always mexican marzo brief
573f8800498ebf9f9cb36422;whether made reservation wait
60cb175230cc47201eac2b5d;20 branch includes 3 bloody marks mimosas screwdriver cant go wrong cure hangover alcohol haha
59c6badc2079556b585d4b2a;delicious margaritas bc diablo looked like frac party
573f8800498ebf9f9cb36422;good place kids
4c866a48dc018cfaae11ef6c;village voice excited doughnut plant 2012 choiceeats food fest full list restaurants
573f8800498ebf9f9cb36422;crime buried surprisingly small packs quite taste
573f8800498ebf9f9cb36422;remember theyre closed monday
5cae4c8cb3c961002c6533a9;coconut crime bre carrot cake amazing lavender strange good thru sold church supposedly amazing
5f6a2cbffbb8d3382339db1e;tres leaves dont classic must
5a801d1f82a75057c022c6ef;opt seasonal doughnut amazing iced coffee wont disappointed
5a801d1f82a75057c022c6ef;best doughnut ever coffee service
5bc784a7666116002c1e090d;eat doughnut yea
573f8800498ebf9f9cb36422;humans baba matter bread foul leone fantastic delicious
573f8800498ebf9f9cb36422;past blue ribbon
5bc784a7666116002c1e090d;eat pickle chips
4f2d37f9e4b04796490faf48;tasty mac cheese happened pigs blanket
573f8800498ebf9f9cb36422;peter amazing ebelskivers blow mind
55de1b6c498eb885f90538d3;get castles eggs cheese green chile slider runs
57c483a3498e92027392c487;menu endless nothing ive disappointed far chicken outlet sandwich lamb chili wales delicious dont get caught taking photos
4f2d37f9e4b04796490faf48;get full order mac n cheese pancake half order scores pancake enjoy friend
573f8800498ebf9f9cb36422;prepare wait line gain 10 pounds
573f8800498ebf9f9cb36422;try everything
60cb175230cc47201eac2b5d;santana pete could best sandwich ive ever 3 eggs turn stunning branch order
573f8800498ebf9f9cb36422;youre going get kicked put phone
573f8800498ebf9f9cb36422;crayon provided papertablecloth covering pleasure fun
573f8800498ebf9f9cb36422;crayon
573f8800498ebf9f9cb36422;best wings tribe
573f8800498ebf9f9cb36422;winner best use habanero village voice 2011 best issue habanero grapefruit mark make forget youre drinking tequila
59c6badc2079556b585d4b2a;best enchiladas de mole en see also tamarind margaritas medal micheladas
59c6badc2079556b585d4b2a;habeeroinfused grapefruit margaret hot dare u find good
5cb37f88fdb9a7002cdf337d;coolest bar les get michaelada fish pork ticos
573f8800498ebf9f9cb36422;english favorite drink
59c6badc2079556b585d4b2a;habanero grapefruit margaret favorite drink city drink 3 get weird
59c6badc2079556b585d4b2a;u need lil hot happy check habaneroinfused grapefruit margaret start hit ticos al pastor estado finish entries
573f8800498ebf9f9cb36422;micheladas excellent
59c6badc2079556b585d4b2a;bests margaritas lower
5bc784a7666116002c1e090d;loved place young fund2026 perfect final destination late night eats night pursuing plethora nearby watering holes check else said review
59c6badc2079556b585d4b2a;order ticos grapefruit margaret done
59c6badc2079556b585d4b2a;im tico fan awesome habanero margaritas popular others buds go cant even look without reaching water hot
573f8800498ebf9f9cb36422;winterbock hammer pork belly emseauflauf veg grain dummy happy
573f8800498ebf9f9cb36422;definitely order anything draft recommend schweinebraten almost like parish prime rib
573f8800498ebf9f9cb36422;one authentic german beer halls glyfada thrown lederhosen sit outside order liter prequel
573f8800498ebf9f9cb36422;spate estimator obatzda radio wammerle forgotten anything
573f8800498ebf9f9cb36422;beer
573f8800498ebf9f9cb36422;beware cash radio brothel obatzda fantastic btw german
573f8800498ebf9f9cb36422;caller winter
5814f39e38fab7673f30f0e9;look football team thursday notes sure sing zum schneider songs
573f8800498ebf9f9cb36422;jack man
58060b33d67c47a958f89339;amazing sushi best
593c42250457b735c9d9dd02;get superman roll tuna avocado sala also great
573f8800498ebf9f9cb36422;best temporal ive east village
573f8800498ebf9f9cb36422;duck tata specials menu must get
5bc784a7666116002c1e090d;great quick cheap italian option solo
573f8800498ebf9f9cb36422;wonder common problem
5bc784a7666116002c1e090d;best italian dishes lower glyfada great price good lunch dinner
5051ad96e4b09819b92cc135;lunch special soup prosciuto sandwich unreal
573f8800498ebf9f9cb36422;try pasta spot foodspotting
5cb37f88fdb9a7002cdf337d;always always sit downstairs preferably back corner bar good view entire room upstairs know
573f8800498ebf9f9cb36422;get octopus yeah one absolute fans dont leave without also getting sucking pig parts soft parts crisp every part made
5b6489cd031320002c9ee47a;get margaret pizza sometimes exactly need
573f8800498ebf9f9cb36422;homemade pappardelle pasta real
573f8800498ebf9f9cb36422;popular amongst chef crowd work rustic heart fulfilling definitely sit downstairs
51eae530498e053b23bd2bd8;one best happy hours solo drinks small plates go chu ti kim ke sal mari die 5plate beware pieces per plate definitely want
60cb175230cc47201eac2b5d;branch eggs alla bolognese amazing coffee much
5bc784a7666116002c1e090d;eat whatever special menu cant go wrong pumpkin ravioli delicious
573f8800498ebf9f9cb36422;contest desert ever taste must try pannacotta eagles cream flag mix berries tips pics nomnomboriscom
5cae4c8cb3c961002c6533a9;perfect seafood pasta tagliolini fate shrimp clams mussels swallows calamari tips pics nomnomboriscom
573f8800498ebf9f9cb36422;never go wrong nomnom bruschetta tips pics nomnomboriscom
5cae4c8cb3c961002c6533a9;wow great appetite must try calamari alla ganglia tips pics nomnomboriscom
5f91d0d5bd1cc65e69f560e6;sunday night jazz band great cant beat 5 glasses house wine
58060b33d67c47a958f89339;surprisingly good sushi least lunch time great prices portions well 3 4 petals via fond
593c42250457b735c9d9dd02;good shumaitwin tuna roll
573f8800498ebf9f9cb36422;winner best brewpub village voice 2011 best issue take limited city space make impressive array craft crews
573f8800498ebf9f9cb36422;override mediocre beers bland food
573f8800498ebf9f9cb36422;beer combinations pretty good
593c42250457b735c9d9dd02;beer fries pomegranate margaritas 3 4 petals via fond
5bc784a7666116002c1e090d;tonight honey porter great dark beer
573f8800498ebf9f9cb36422;artichoke spinach dip artichoke found dont let mislead
5cae4c8cb3c961002c6533a9;dont calamari disgusting
573f8800498ebf9f9cb36422;oktoberfest thumbs
573f8800498ebf9f9cb36422;try french toast ale season indiana pale ale usually way yo go
573f8800498ebf9f9cb36422;beans rice combo special typically fill weeks
573f8800498ebf9f9cb36422;rice horizon good addition empanada
573f8800498ebf9f9cb36422;theyre known excellent gnocchi owner silva marchetto always around may help make selection
5051ad96e4b09819b92cc135;lobster gnocchi unreal seriously life changing
4c866a48dc018cfaae11ef6c;good restaurant
5cb37f88fdb9a7002cdf337d;bar six lemonade yes beware large
60cb175230cc47201eac2b5d;sunny sunday noon consider place branch menu always great day night neighborhood fixture sit fulfilled back slight
573f8800498ebf9f9cb36422;one bathroom smells like orange creamsicle choose
5c0d852abe7078002cfbc362;bisteeya clear winner flak morocco meat pie
60cb175230cc47201eac2b5d;super cute inviting day recommend eggs florentine crisp bacon side branch
5f4fe6286a74f475f7e99a29;one top goto spots dinner east village cosmic always go strip steak medium rare barnaise sauce fries escargot cabinet ps decent branch
506f0bece4b0bb95516a6222;forget hour long wait clinton st bakery 1095 branch includes coffee oj youre surrounded help crowd
5bc784a7666116002c1e090d;merge conscious great love spot
573f8800498ebf9f9cb36422;remember go check cecicela 55 spring st btw lafayette mulberry glyfada ps added iphone
5814f39e38fab7673f30f0e9;hidden back room took three years realize great quick lunches midday meetings tea
5bc784a7666116002c1e090d;sit front open windows summer many great places area great people watching
4d2ccf77ad25224b2331fa8f;love first sight
5009a1f1e4b0e95403cfc27b;love vegetarian latter u2013 3 dishes think dressed salad perfect lunch time treat
4d2ccf77ad25224b2331fa8f;guy brought falafels greece best cheapest magical try falafel humans sandwich 3 ill take thank notes p
4d2ccf77ad25224b2331fa8f;famous best place falafel sharma om nom nom nom
4d2ccf77ad25224b2331fa8f;ridiculously cheap falafel quality drop youre neighborhood looking cheap tasty relatively filling snack
4d2ccf77ad25224b2331fa8f;get falafel pit sharma pit 750 best foodlatenight foodstreet food planet america
4d2ccf77ad25224b2331fa8f;solid hot sauce real hot though casual warning
5990934cdd84420428345b93;ov falafel chicken also delist
5990934cdd84420428345b93;get falafelduh chicken labor pretty good btw
5bc784a7666116002c1e090d;250 falafel 30 seconds great food late nights quick lunches
5bc784a7666116002c1e090d;great best hot dog world cheap quick excellent must see check point glyfada hot dog fan
5cb37f88fdb9a7002cdf337d;best latenightpostbar food ever
4d2ccf77ad25224b2331fa8f;htdocs amazing leave hotdog carts alone
4d2ccf77ad25224b2331fa8f;recession special isnt bad two hot dogs drink 445tax included
4c866a48dc018cfaae11ef6c;mario battles first restaurant
5f91d0d5bd1cc65e69f560e6;mondaytuesday complimentary wine meal
5f91d0d5bd1cc65e69f560e6;nicole best waitress glyfada ask recommendations pairing suggestions food wine
4d2ccf77ad25224b2331fa8f;cheap cheerful excellent italian comfort food
5cb37f88fdb9a7002cdf337d;great speaks hang bar
5cb37f88fdb9a7002cdf337d;dont bother bar
5f4fe6286a74f475f7e99a29;service pleasant slow steak delicious
5f4fe6286a74f475f7e99a29;loved ny steak tuna warfare
4d2ccf77ad25224b2331fa8f;scoop consist two flavors want still price
4d2ccf77ad25224b2331fa8f;try taro flavor refreshing way end meal super delicious
57c483a3498e92027392c487;black sesame green tea ice cream nom nom nom
57c483a3498e92027392c487;zen butter best ice cream ever
57c483a3498e92027392c487;red bean ice cream great dont let
5051ad96e4b09819b92cc135;try dummy tomato eggplant soup vegetarian
5bc784a7666116002c1e090d;try macaroons tasty treat top meal
4d2ccf77ad25224b2331fa8f;elegant locations regional mexican fare legendary mole known manchamanteles
5051ad96e4b09819b92cc135;order lots guacamole appetite entries
5cb37f88fdb9a7002cdf337d;sit bar chat bartender get best margaritas rocksplus get guacamole
4d2ccf77ad25224b2331fa8f;bit expensive tourist food always dummy try double pan fried noodles
573f8800498ebf9f9cb36422;try monitor
4d2ccf77ad25224b2331fa8f;dragon roll shit anything eel good
4d2ccf77ad25224b2331fa8f;pulled pork sandwich witness
5051ad96e4b09819b92cc135;pho son song combination rice noodles soup grilled pork chop much needed cold cold lazy sunday lunches 5 degrees
4d2ccf77ad25224b2331fa8f;best pho ive glyfada yet
4d2ccf77ad25224b2331fa8f;read place twice today exe need try places hood
5990934cdd84420428345b93;ate whole plate whole plate 12 beef noodle broth
5bc784a7666116002c1e090d;food delicious overall experience could better fan top 40 radio commercials highly recommend area looking great cheap bite
4fe21ffbe4b0f27f28501755;one day youre feeling especially fat come get choice burger ndor philly cheesesteak ndor hot dog better
4fe21ffbe4b0f27f28501755;like get turkey burger english muffin
4fe21ffbe4b0f27f28501755;best mean best burgers glyfada period
4fe21ffbe4b0f27f28501755;one favorite burger places opt classic along gravy cheese fries
4fe21ffbe4b0f27f28501755;got soul burger bacon cheeseburger ham fried onions loved
50f17d21e4b0e2cb83061005;eastsider specialty pretty darn good bacon ham mushrooms tomatoes fried onions
4fe21ffbe4b0f27f28501755;sweet potato fries mayo bacon cedar burger ice cold stella
4fe21ffbe4b0f27f28501755;bacon cheeseburger big delicious sweet potato fries
5c0d852abe7078002cfbc362;great tastes like meatloaf
60cb175230cc47201eac2b5d;really fantastic choices branch try something normally wouldnt
547605ce498e29745d7d59f5;coached eggs salmon potato cake yum
5f4fe6286a74f475f7e99a29;seriously wonderful ev staple get schnitzel danger steak price steal
4d2ccf77ad25224b2331fa8f;24 7 anymore kitchen closes like weekend nights
593c42250457b735c9d9dd02;american eggwhite omelette spinach tomato meta wheat toast welldone homefries creative hangover
4b487745f964a520c04d26e3;rarely ever wait breakfast till 4 everyday including remarkably dummy oatmeal free wifi also open 247 honorary
60cb175230cc47201eac2b5d;best branch ev outdoor seating warm
5f4fe6286a74f475f7e99a29;steak eggs terrific
60cb175230cc47201eac2b5d;great branch spot sit outside nurse cup coffee ndor hangover order smoked salmon cream cheese omelette delicious
5f4fe6286a74f475f7e99a29;best steak eggs branch area weekdays
60cb175230cc47201eac2b5d;smoked salmon eggs potatoes hollandaise sauce amazing roche french toast best branch ive glyfada
4d2ccf77ad25224b2331fa8f;try pomegranate spare delicious
55de1b6c498eb885f90538d3;pumpkin pancake cinnamon yogurt scrumptious great coached eggs florentine well
4d2ccf77ad25224b2331fa8f;open late street yay
5bc784a7666116002c1e090d;pumpkin pancake great side sausage good omlettes good meta olive especially
