ID;Comment
5697f2c2498e7ea36e332f6f;try triple delight awesome
5697f2c2498e7ea36e332f6f;ginger onion lo mein like crack delicious crack
5697f2c2498e7ea36e332f6f;try triple delight awesome
5697f2c2498e7ea36e332f6f;great staff always happy lunch rush hour
4e3472618877beb5e9a14aa9;like places part glyfada destination refuge youre lost kids bay good pages good sandwiches outstanding courteous service 3 4 petals via fond
4e3472618877beb5e9a14aa9;brigitte tops remembers order keeps babel warm im running late
509b7e5de4b03b06dafcf6b2;iced hazelnut coffee way
58060b33d67c47a958f89339;use hidden cash register opposite pain drills cashonly save time
5cb37f88fdb9a7002cdf337d;seems everyone agrees queen barnstar get order wrong roll eyes try correct
5803982438fa2d2166a8d529;less crowded 16th 8th location
5803982438fa2d2166a8d529;removed electric sockets mother breakers bring extra batteries write complaint least peak hours need plug
5803982438fa2d2166a8d529;service slow
547605ce498e29745d7d59f5;usually get tall cartel macchiatto really enjoying cinnamon role late
5697f2c2498e7ea36e332f6f;anything crisp pork
5697f2c2498e7ea36e332f6f;wow fantastic food great friendly service def coming back
5c0d852abe7078002cfbc362;solid italian food good pasta meat fish good wine list well nice place date 3 4 petals via fond
5051ad96e4b09819b92cc135;get appetite half portion donburi complete meal
5803982438fa2d2166a8d529;cats pretty good 12 guess cant complain large beers stein points
5697f2c2498e7ea36e332f6f;place eat glyfada bullshit
5f91d0d5bd1cc65e69f560e6;best nan bread mushroom sang amazing well priced equally good valued wine list
4b16df5bf964a520c0be23e3;mediterranean verge burger dressing quite tasty affordable quick
5697f2c2498e7ea36e332f6f;place dirty dont eat go one 6th ave instead
5803982438fa2d2166a8d529;get gnocchi real rage delicious
50f17d21e4b0e2cb83061005;shrimp camara tico small
5697f2c2498e7ea36e332f6f;get h1 whole wheat wrap
5009a1f1e4b0e95403cfc27b;terrible name great food get remade roll in45 seconds comes micro salad pickle
5803982438fa2d2166a8d529;making personal sized pies
5814f39e38fab7673f30f0e9;grapefruit pulp tea best
5814f39e38fab7673f30f0e9;milk tea honey coconut personal favorites
5990934cdd84420428345b93;get amazing popcorn chicken bubble tea slashes great well
5803982438fa2d2166a8d529;dont let joints terribly chosen name fool diner fare dependably good fairly priced experience
5697f2c2498e7ea36e332f6f;reasonable prices great food cool upstairs seating area
5697f2c2498e7ea36e332f6f;borderline shady seating scene upstairs decent
5051ad96e4b09819b92cc135;get bel pure appetite spicy worth
5803982438fa2d2166a8d529;15 credit card minimum know
5803982438fa2d2166a8d529;owner rude hes efficient keeps line moving fuggedaboudit
5803982438fa2d2166a8d529;eagles excellent staff always nice sure rude owner mentioned another tip
5398b008498e50a50cfcd2b9;free misc soup sushi rolls weekday lunch
5990934cdd84420428345b93;chicken temporal spicy
5803982438fa2d2166a8d529;tommy combo pre packaged spammy bomb
5803982438fa2d2166a8d529;get drinks dinner bill first time see waiter wont see
547605ce498e29745d7d59f5;reggae breakfast sandwich skinny cartel macchiato
5803982438fa2d2166a8d529;get early closed early
5803982438fa2d2166a8d529;say thank vote
5803982438fa2d2166a8d529;bad service
5803982438fa2d2166a8d529;customer service sucks
5803982438fa2d2166a8d529;bottle caps terrific little snacks
5f6a2cbffbb8d3382339db1e;order sweet tea vodka lemonade sing along sweet caroline oh hhh
5803982438fa2d2166a8d529;wild park sandwich pretty damn good substitute later ots salt vinegar chips
5803982438fa2d2166a8d529;make sure get jalapeo bottle caps yum
5990934cdd84420428345b93;pulled chicken isnt pulled like died
5803982438fa2d2166a8d529;wandering pulled pork sandwich look elsewhere
5803982438fa2d2166a8d529;try cornered incredible best ive ever
5398b008498e50a50cfcd2b9;eaten countless sushi places around glyfada place amazing price quality quantity attentive staff defiant back
50f17d21e4b0e2cb83061005;solid slice extra parm
509b7e5de4b03b06dafcf6b2;peppermint mecha lowest cinnamon coffee cake must
5803982438fa2d2166a8d529;despite heavy volume customers shocks fast efficient love coming friendly staff
5803982438fa2d2166a8d529;andre manager makes location best glyfada
5697f2c2498e7ea36e332f6f;order via app online beat long lunch lines go straight register pick order
5990934cdd84420428345b93;yes put pastrami chicken outlet thanks tastes
593c42250457b735c9d9dd02;get curly fries theyre amazing gonna miss eating friends
4b16df5bf964a520c0be23e3;marina nailed head get burger
5803982438fa2d2166a8d529;think shocks policy regard ice water business perspective mention psychological one pathetic
5803982438fa2d2166a8d529;looking camp get work done keep walking covered outlets
5803982438fa2d2166a8d529;lines grow shrink based intercity buses picking theres much come early hope catch break upstairs nice waiting bus though
5697f2c2498e7ea36e332f6f;good meetings dont need laptop power outlets covered theres upstairs area seating thats usually relatively empty
5697f2c2498e7ea36e332f6f;closed outlets stupid seating arrangement
5697f2c2498e7ea36e332f6f;love lunch bent boxes great food great value
5803982438fa2d2166a8d529;order sesame balls order conviction
509b7e5de4b03b06dafcf6b2;worst coffee blocks blocks tina turner celine dion willie nelson buffy shrine keep coming back
5803982438fa2d2166a8d529;make sure get fist bump john leave
5803982438fa2d2166a8d529;sloppy john little demi curious george notorious nick really cant go wrong
5697f2c2498e7ea36e332f6f;omg hands best flag ive ever tasted mi indigo mexican 8th av beta 51st 52nd sts owners treat
5803982438fa2d2166a8d529;get flag
5803982438fa2d2166a8d529;fresh inexpensive authentic mexican located next door chipotle choose chipotle spot friend
5009a1f1e4b0e95403cfc27b;breadsticks salad must breaking love
5803982438fa2d2166a8d529;favorite vegetarian dish 16 tel gyathuk nota salted noodles mixed fresh green vegetables tofu make sure add chili sauce get side
5051ad96e4b09819b92cc135;one best deals town get soups heart heartwarming appetite everything ive delicious
5803982438fa2d2166a8d529;amazing food bob
5803982438fa2d2166a8d529;dumping spicy saucethe best
5803982438fa2d2166a8d529;place used rock used regular owners skipping ingredients though last time ordered pasta credible ordered since
5697f2c2498e7ea36e332f6f;long hiatus tried place impressed antonio really sighted ship favorite italian spot neighborhood great food service price
509b7e5de4b03b06dafcf6b2;shocks worst coffee glyfada avoid like plague must visit place use bathroom make sure bring hand sanitizer
5803982438fa2d2166a8d529;see place looks like renovation
5803982438fa2d2166a8d529;tourist protiv public restroom back right key needed please tip well
5803982438fa2d2166a8d529;5 laptop writers today least ipad
5803982438fa2d2166a8d529;see 3 laptop writers lol
509b7e5de4b03b06dafcf6b2;hot coffee n debuts
5803982438fa2d2166a8d529;know three months late see four laptop writers spot five
5803982438fa2d2166a8d529;amazingly expensive french toast _
5697f2c2498e7ea36e332f6f;skip pf change place better treat people nicer
5803982438fa2d2166a8d529;go anti vivo bob dining experience
5f4fe6286a74f475f7e99a29;best steak eggs best breakfast barrio best french fries place montclair must
5803982438fa2d2166a8d529;get mexican hot chocolate great
509b7e5de4b03b06dafcf6b2;coffee amazing
5697f2c2498e7ea36e332f6f;greatest place eat nj hands location presentation experience seriously
5009a1f1e4b0e95403cfc27b;great salads cant go wrong asian chicken calamari cbb salads chill atmosphere dont take amex
5cae4c8cb3c961002c6533a9;move 37th 5th get 36th street n r stop best ticos glyfada
5803982438fa2d2166a8d529;delicious youre ever walking around neighborhood stop pick giant chocolate chocolate 1 also deliver late night
5803982438fa2d2166a8d529;peanut butter cup drooooool
4b16df5bf964a520c0be23e3;energy burgers best city win
5803982438fa2d2166a8d529;last days 5 wraps nov
5697f2c2498e7ea36e332f6f;great tasting local breakfast items 299 11
4b16df5bf964a520c0be23e3;get burger add baked fries 1 try style
547605ce498e29745d7d59f5;never get potatoes broccoli potatoes foggy broccoli cooked
5009a1f1e4b0e95403cfc27b;dollars salad month july
5c0d852abe7078002cfbc362;love bison cheesesteak wrap try turkey meatloaf
614da84c47cfb55dae6b9fab;fish chips must come kind prehistoric sea creature huge way big one person finish unless hulk
4f2d37f9e4b04796490faf48;try welsh rabbit heavenly open faced grilled cheese ever also skip apple berry rumble sauce
5803982438fa2d2166a8d529;deeply anything bring anything
4d7e4efbb25d6dcb1117b742;fried ffa cakes might greatest dessert earth theyre 2 excuse get
5a801d1f82a75057c022c6ef;try avoiding branch make sure skip dinner dont go looks kinda nice outside
5a801d1f82a75057c022c6ef;try avoiding branch make sure skip dinner dont go looks kinda nice outside
5a801d1f82a75057c022c6ef;try avoiding branch make sure skip dinner dont go looks kinda nice outside
5a801d1f82a75057c022c6ef;try avoiding branch make sure skip dinner dont go looks kinda nice outside
5a801d1f82a75057c022c6ef;try avoiding branch make sure skip dinner dont go looks kinda nice outside
5a801d1f82a75057c022c6ef;try avoiding branch make sure skip dinner dont go looks kinda nice outside
5a801d1f82a75057c022c6ef;try avoiding branch make sure skip dinner dont go looks kinda nice outside
5a801d1f82a75057c022c6ef;try avoiding branch make sure skip dinner dont go looks kinda nice outside
5a801d1f82a75057c022c6ef;try avoiding branch make sure skip dinner dont go looks kinda nice outside
573f8800498ebf9f9cb36422;want motto upper west side cant make calle och near anh best best
5803982438fa2d2166a8d529;order pitch watered ganglia make drink front
5803982438fa2d2166a8d529;ganglia amazing quite expensive definitely worth youre looking awesome drink even make right front
5697f2c2498e7ea36e332f6f;seafood della great selection little price receive large amount seafood arrives tablesi fancy pot
5803982438fa2d2166a8d529;latin hot chocolate absolutely delicious worth way 4 bucks charge
5697f2c2498e7ea36e332f6f;cuban sandwiches great
5697f2c2498e7ea36e332f6f;absolutely great place eat love empanadas monitor pomegranate monitor tasty
5803982438fa2d2166a8d529;hosting harlem film festival party
4b16df5bf964a520c0be23e3;kobe burger cheap excellent
5803982438fa2d2166a8d529;ask 3 falafel pit
5697f2c2498e7ea36e332f6f;handicap access seating area 2nd floor
5051ad96e4b09819b92cc135;get special 12 sandwich small soupsandwich cant go wrong
5c0d852abe7078002cfbc362;meat menu eat
5990934cdd84420428345b93;grilled chicken breast chipotle mayo good choice
5803982438fa2d2166a8d529;look sandwiches fine glyfada nit exactly hard find good singer forget sandwiches focus chocolate croissant focus buy superb
547605ce498e29745d7d59f5;lobster issue heavenly free potato chips
5b6489cd031320002c9ee47a;entirely different pizza experience get used brooklyn least dozen different pizza choose time one slice meal unless youre really hungry type
5803982438fa2d2166a8d529;next please
5990934cdd84420428345b93;chicken cesar day everyday
50f17d21e4b0e2cb83061005;next please many want five slices
5b6489cd031320002c9ee47a;best pizza glyfada get plain slice make sure shout
5b6489cd031320002c9ee47a;best pizza glyfada get plain slice make sure shout
5803982438fa2d2166a8d529;jury duty stop quick cheap lunch 5 delist pork chile dumping 125
5803982438fa2d2166a8d529;place endorsed bradley laborman
5697f2c2498e7ea36e332f6f;come great thai food try noodles peanut sauce everything great cashonly bit pain tho
5398b008498e50a50cfcd2b9;great lunch sushi roll specials dont order chirashi pretty weak
5a801d1f82a75057c022c6ef;come branch
5b6489cd031320002c9ee47a;cheapest pizza village
5b6489cd031320002c9ee47a;hard beat 1 slices pizza
5803982438fa2d2166a8d529;say thank vote
5990934cdd84420428345b93;chicken mikka amazing every time tender tasty quite filling singleperson entrez
593c42250457b735c9d9dd02;try tuna melt one best town
5803982438fa2d2166a8d529;branch needs retain staff
5803982438fa2d2166a8d529;morning staff much better afternoon evening staff
57c483a3498e92027392c487;luv shaved ice cream big good
5803982438fa2d2166a8d529;little cheaper koryodang interior little cramped theres decent selection snacks pastries
5803982438fa2d2166a8d529;two words strawberry bingo
5803982438fa2d2166a8d529;tango pork kimchidillas favorites
5803982438fa2d2166a8d529;get extra hot want sauce sizzzzzle
5803982438fa2d2166a8d529;try square pie via foodspotting
593c42250457b735c9d9dd02;tuna gary dish amazing
5398b008498e50a50cfcd2b9;real sushi dont rolls theres hiding quality fish behind special sauces fresh fish fresh asahi real ginger want omakase 4 4 petals via fond
593c42250457b735c9d9dd02;order tuna gary piece tuna prepared uniquely get anywhere else
51eae530498e053b23bd2bd8;oyster happy hour best lobster roll drinks created loving decent value
5803982438fa2d2166a8d529;dont sit front doors avoid fans things break go shooting across place
5803982438fa2d2166a8d529;ordered food online got quickly enjoyed outside coming back
5803982438fa2d2166a8d529;ew microwave almost everything
5697f2c2498e7ea36e332f6f;order via app online beat long lunch lines go straight register pick order
5b6489cd031320002c9ee47a;pretty good pizza nj try garlic knots
5803982438fa2d2166a8d529;cool fake autograph guitars line walls
50f17d21e4b0e2cb83061005;classy joint get excellent slice hot italian hero entire space pays homage music featuring cool memorabilia special portrait local boy
509b7e5de4b03b06dafcf6b2;great coffee theyre menu serve blueberry pancake
593c42250457b735c9d9dd02;french fries delicious
5009a1f1e4b0e95403cfc27b;isolate portion menu joke either best salads ever
5b6489cd031320002c9ee47a;mezzaluna get props deserves thankful radar este motoring co etc otherwise would need wait line best sleeper pizza city ice tea must
5803982438fa2d2166a8d529;love fee atm ive never problem
5803982438fa2d2166a8d529;rockefeller center dummy overpriced
4b487745f964a520c04d26e3;good breakfast spot often crowded line moves quick staff super polite
5b6489cd031320002c9ee47a;pizza great especially woodfired pie squares entries huge portions chicken frances penned vodka must hats chef neighborhood classic
5990934cdd84420428345b93;squares delicious chicken franchise also amazing penned vodka classic hats chef
5b6489cd031320002c9ee47a;really good pizza great atmosphere dine
5697f2c2498e7ea36e332f6f;dont eat
5803982438fa2d2166a8d529;pinkberry best ever better red mango others
5803982438fa2d2166a8d529;front patio perfect people watching
5803982438fa2d2166a8d529;choice pumpkin spice late lasts
5803982438fa2d2166a8d529;crappy slow service pad thai sucks drink prices
5697f2c2498e7ea36e332f6f;discovered place right apt mom visiting try come back every couple weeks great food quick service
4c866a48dc018cfaae11ef6c;mez super fresh staff couldnt nicer great restaurant around
5803982438fa2d2166a8d529;best chinolatino city
5803982438fa2d2166a8d529;cubanstyle roast pork available prison delicious leaves plenty leftover
5990934cdd84420428345b93;fried chicken outlet always moist treat
5009a1f1e4b0e95403cfc27b;iced cap hoc savings bloc salad sibling duck creep 4 uber yum rating
59c6badc2079556b585d4b2a;margaret came salt wasnt asked wanted salt assumed would line rim
5697f2c2498e7ea36e332f6f;much nicer name suggests great lunch prices
5803982438fa2d2166a8d529;hawaii riley else say yeahhhhhh budddyyy
5009a1f1e4b0e95403cfc27b;french dip grilled chicken salad apple cobbled amazing
4c866a48dc018cfaae11ef6c;great restaurant list dinner rockville md location
5cb37f88fdb9a7002cdf337d;sit bar make sure marie
5803982438fa2d2166a8d529;best pasta bolognese town
5803982438fa2d2166a8d529;mea mushroom risotto good
5990934cdd84420428345b93;order rigatoni alla vodka grilled shrimp grilled chicken superb
5803982438fa2d2166a8d529;refusing bowl gets free topping
5990934cdd84420428345b93;go pest chicken paradise w cherry shallow vinaigrette tell go light dressing though dont mind line moves quick though miguel needs relax
5a801d1f82a75057c022c6ef;go branch
5a801d1f82a75057c022c6ef;sunday branch plates best mimosas
593c42250457b735c9d9dd02;cup cobra fries trio spinach promise everything else sounds good
614da84c47cfb55dae6b9fab;fish ticos
5803982438fa2d2166a8d529;order 4 hrs advance food takes soo looooong
5803982438fa2d2166a8d529;order online via app eliminate lunch line
5697f2c2498e7ea36e332f6f;order via app online beat long lunch lines go straight register pick order
5398b008498e50a50cfcd2b9;anaconda roll sashimi special huge menu fugue
4c866a48dc018cfaae11ef6c;overly impressed place although service great food didnt live fact part alain ducasse family restaurants stick basics
5803982438fa2d2166a8d529;second polish latter
5803982438fa2d2166a8d529;try ganglia
5f4fe6286a74f475f7e99a29;try skirt steak wont regret
5697f2c2498e7ea36e332f6f;great service amazing food always pleasure
5697f2c2498e7ea36e332f6f;great food dont come youre rush
4b16df5bf964a520c0be23e3;texas turkey burger official
53c5c014498e6f81099df055;tried new greek paninireally nice vinaigrette meta cheese makes even better
4f2d37f9e4b04796490faf48;new item buffalo chicken wrap buffalo sauce blue cheese right par im buffalo like spicy right ally also great customer service
4f2d37f9e4b04796490faf48;new item buffalo chicken wrap buffalo sauce blue cheese right par im buffalo like spicy right ally also great customer service
5803982438fa2d2166a8d529;strawberry mango peach smooth yum
509b7e5de4b03b06dafcf6b2;avoid place costs every experience ive bad except coffee coffee good
5803982438fa2d2166a8d529;managers servers know special posted patient
4c866a48dc018cfaae11ef6c;fastest ribs find chain restaurant
5cb37f88fdb9a7002cdf337d;get juice juice bar
5803982438fa2d2166a8d529;empanadas awesome
4f2d37f9e4b04796490faf48;mac n cheese similar mac satisfying super nice owner friendly staff make go back
5803982438fa2d2166a8d529;dumping hot sour sauce
5803982438fa2d2166a8d529;try dumping theyre amazing yes really called flavour snack
5c0d852abe7078002cfbc362;get hot cold noodles spicy meat sauce spicy
5b6489cd031320002c9ee47a;love pizza open late around corner old guys nice wife around consistent win
509b7e5de4b03b06dafcf6b2;foam coffee
593c42250457b735c9d9dd02;fries well done mozzarella toward gravy side
5009a1f1e4b0e95403cfc27b;try raspberry chicken salad
5803982438fa2d2166a8d529;get roasted pork special amazing
509b7e5de4b03b06dafcf6b2;best coffee hood great small pages
5803982438fa2d2166a8d529;pay attention name changing one letter communicated caffeinated core mission avoided lengthy nasty trademark dispute
5009a1f1e4b0e95403cfc27b;chicken salad ciabatta dummy
5f91d0d5bd1cc65e69f560e6;drink specials 59 buy 1 get free well liquor wine one beers teiresias martini
5f91d0d5bd1cc65e69f560e6;first time mushroom risotto amazing fray pasta country rage pretty good excellent wine offering
5803982438fa2d2166a8d529;chelsea staple friendly staff accommodate large party moments notice
5990934cdd84420428345b93;chicken ball ftw
5803982438fa2d2166a8d529;pick humans fresh pits best neighborhood
5051ad96e4b09819b92cc135;though wasnt bad id say avoid place least dont get lobster rollsandwich tiny runoff
5803982438fa2d2166a8d529;rice balls
5803982438fa2d2166a8d529;tell christian say hello
5b6489cd031320002c9ee47a;best pizza glyfada actually thats understatement lol
5814f39e38fab7673f30f0e9;come battery croissants apple pear turnovers artisans breads organic teas forget listed calories enjoy michellectv
5051ad96e4b09819b92cc135;super inexpensive inexpensive delicious soup sandwich combo
5803982438fa2d2166a8d529;best lunch spot ever
51eae530498e053b23bd2bd8;happy hour 3pm 6pm
5803982438fa2d2166a8d529;big big smile always better service
5803982438fa2d2166a8d529;musthaveredeye
5803982438fa2d2166a8d529;say thank vote
5697f2c2498e7ea36e332f6f;mussels far one best ive eat tuesday
4b16df5bf964a520c0be23e3;get burgers medium rare dummy
4b16df5bf964a520c0be23e3;possibly best burgers city juicy english muffin try fresh mozzarella
4b16df5bf964a520c0be23e3;burgers best anywhere sunday theyre seven dollars get fries
57116a25498ea9ddf52437b7;make sure ask rolls scrumptious
5803982438fa2d2166a8d529;linguist fra div wanna stay
5697f2c2498e7ea36e332f6f;shop shows starbucks became global hit guys make feel like home starbucks like one really great
5803982438fa2d2166a8d529;say thank vote
5803982438fa2d2166a8d529;shrimp scrambled egg rice simple yet addiction menu go chinatown line ask
509b7e5de4b03b06dafcf6b2;great coffee solid chain pb baguette counter perfect little snack great bench inside outside watch solo painter stage far
509b7e5de4b03b06dafcf6b2;great coffee get large cappuccino greater steve wonder soundtrack
5803982438fa2d2166a8d529;prosciutto sandwich painfully delicious
5045e3e9e4b0c78b23afd97b;cute cafe delicious coffee cookies sandwiches theres also lovely slight area back stacks nat geo back issues flip great spot
51eae530498e053b23bd2bd8;great muffinsan actual good bran one healthy tiny peanut butter jelly sandwiches amazing sandwich happy hour great wine good go happy hour
5803982438fa2d2166a8d529;5 5pm voodoo
5803982438fa2d2166a8d529;special promo doesnt work food good pretty similar chipolte
547605ce498e29745d7d59f5;iced american mmmm
5803982438fa2d2166a8d529;rarely say
5f6a2cbffbb8d3382339db1e;best iced late ever also fresh fruit filled muffin yum
5803982438fa2d2166a8d529;try tongue sandwich dummy inappropriate goaheadandmakefunofmeidareyou via foodspotting
5990934cdd84420428345b93;get deli double pastrami corner beef w rye way go
5c0d852abe7078002cfbc362;must sit counter great show everything great esp salmon rice grilled meats
5803982438fa2d2166a8d529;get italian sub tasty fresh billion times better subway
5697f2c2498e7ea36e332f6f;smoked turkey w sweet mustard whole wheat
58060b33d67c47a958f89339;mongolia grill monglians really eat like
5009a1f1e4b0e95403cfc27b;omg food court fantastic mongolia bibimbap salads
5803982438fa2d2166a8d529;rock shrimp
5803982438fa2d2166a8d529;park avenue roll golden quite literally
5009a1f1e4b0e95403cfc27b;sashimi really fresh crisp duck salad great also try ultimate saketini
5803982438fa2d2166a8d529;gramercy roll tasty
5697f2c2498e7ea36e332f6f;order via app online beat long lunch lines go straight register pick order
5051ad96e4b09819b92cc135;nice atmosphere excellent service familiar thai food order chicken stay tom kar soup
51eae530498e053b23bd2bd8;didnt like jumbo shrimp small plate menu weird tasting sauce shrimp bit tough soft shell blue crab roll really good great strawberry margaritas happy hour every day
5803982438fa2d2166a8d529;gets crowded quickly max 20ish people fit come peak hours
4b16df5bf964a520c0be23e3;dont fooled might want order 10 little burgers 34 eat must best whole state
4f2d37f9e4b04796490faf48;double cheese onions pickles way go lettuce tomatoes allowed
4b16df5bf964a520c0be23e3;chocolate shake good friend said double better single jerry seinfeld ate 13 gas 20 burgers eat die
5f4fe6286a74f475f7e99a29;need singles cheese onion steak cheese takes much stomach space save room spiders wont regret
5803982438fa2d2166a8d529;wearing baby get 10 theres guy around corner rent baby 2
5009a1f1e4b0e95403cfc27b;suit salad amazing feel little weird sans child food super good
5803982438fa2d2166a8d529;cool place
5009a1f1e4b0e95403cfc27b;almond butter lover smooth delist also suit salad mermaid salad dont let baby rollers scare great cafe
5803982438fa2d2166a8d529;shuffled forcing risotto amazing
5a801d1f82a75057c022c6ef;absolutely amazing branch warm homemade croissant apricot jam die coffee delicious well
4f2d37f9e4b04796490faf48;boasted oppseed butter everything untoasted creamcheese
50f17d21e4b0e2cb83061005;something paying 8 two regular slices really mean regular absurd
5803982438fa2d2166a8d529;already tried mushroom dumping crisp tofu also delight
5051ad96e4b09819b92cc135;wild mushroom appetite super tasty also loved grilled chicken bordeaux butternut squash raviolli sauce delicious
5803982438fa2d2166a8d529;delicious roast pork
5803982438fa2d2166a8d529;best roast pork chinatown cheap
5803982438fa2d2166a8d529;fast food exaggeration
5803982438fa2d2166a8d529;make sure get garlic sauce
5803982438fa2d2166a8d529;asked chocolate fronted debuts got chocolate debuts instead
5803982438fa2d2166a8d529;sadly ruined new owners mustavoid unless want rude slow service order screwed possible food poisoning
5803982438fa2d2166a8d529;bathroom r clean
5803982438fa2d2166a8d529;fast cheap detectable
509b7e5de4b03b06dafcf6b2;great french press coffee
5803982438fa2d2166a8d529;bring dog inside
5814f39e38fab7673f30f0e9;try bubble tea
5803982438fa2d2166a8d529;7 layer cake amazingness
5803982438fa2d2166a8d529;case youre waiting train clock 15 minutes slow
509b7e5de4b03b06dafcf6b2;excellent iced espresso coffee driver give spot go sure beats double
5803982438fa2d2166a8d529;tiramisuno need look menu get damn tiramisu
5051ad96e4b09819b92cc135;excellent chicken rice soup
4d7e4efbb25d6dcb1117b742;try schiacciata con lava italian flatbread surface strewn tiny wine grapes anime seeds bread slightly sweet great breakfast dessert
506f0bece4b0bb95516a6222;returned sullivan street bakery compiling
5b6489cd031320002c9ee47a;stretch tomatoes amazingalso new pizza gardener corn spicy kick delicious
5803982438fa2d2166a8d529;awesome sandwiches ciabatta bread really good
5803982438fa2d2166a8d529;
5803982438fa2d2166a8d529;new favorite diner
