ID;Comment
5051ad96e4b09819b92cc135;get powerhouse lambchops lobsteroyster shooters buff said
4c866a48dc018cfaae11ef6c;dear bobby enough tv crap time attain restaurant service blows ad food worse bread best thing hell hole buff said
4c866a48dc018cfaae11ef6c;dear bobby enough tv crap time attain restaurant service blows ad food worse bread best thing hell hole buff said
593c42250457b735c9d9dd02;spicy tuna tartan delist bourbon praise profiterole amazing
5009a1f1e4b0e95403cfc27b;southwestern cbb salad go lunch order
5bc784a7666116002c1e090d;everything great get chips dont order oysters nickel size baseless
51face89498e41b0082ae344;support special never fails remember cash
5bc784a7666116002c1e090d;go 1150 beat rush thank later youre waiting
5bc784a7666116002c1e090d;try support special raven yoga great
51face89498e41b0082ae344;meh nothing write home always mob scene remember talking times square beggars cant chooses
51face89498e41b0082ae344;curry cauliflower dishes usually get sesame
5009a1f1e4b0e95403cfc27b;get guinea salad black beans corn avocado dressings good
5f6a2cbffbb8d3382339db1e;pumpkin raising muffin pretty scrumptious
51face89498e41b0082ae344;crap wifi connection like 1997 dial
51face89498e41b0082ae344;lovely reggae vegan grind cute boys free wifi
5bc784a7666116002c1e090d;temper ruben great
5bc784a7666116002c1e090d;sweet corn pancake great
547605ce498e29745d7d59f5;potatoes barrio
51face89498e41b0082ae344;try find better baklava dare
51face89498e41b0082ae344;add humans meta falafel wrap ask side hot sauce
51face89498e41b0082ae344;add meta human falafel sandwich stellar hotsauce
51face89498e41b0082ae344;freshest pit atlantic ave
51face89498e41b0082ae344;everyone knows get corn try rice milk get go walk around hood
51face89498e41b0082ae344;sometimes cant go wrong arrow poll get plato julia
5bc784a7666116002c1e090d;always feels like fire hazard death trap hey cool
51face89498e41b0082ae344;authentic mexican prepared popular destination high demand
5cae4c8cb3c961002c6533a9;tinge de poll ticos best listed dinner downstairs better drinks downstairs
5cae4c8cb3c961002c6533a9;tried fish ticos everyone talking skeptical bomb find places compare
59c6badc2079556b585d4b2a;pork ticos rice delight breakfast margaret
51face89498e41b0082ae344;best mexican food outside mexico doubt
51face89498e41b0082ae344;cut corn cob
4c866a48dc018cfaae11ef6c;downstairs go grab seat around corner sit restaurant
5051ad96e4b09819b92cc135;favor order gorilla soup best
51face89498e41b0082ae344;best mexican food secret entrance kitchen birthday party private cave
51face89498e41b0082ae344;dont time sit takeaway counter
59c6badc2079556b585d4b2a;love love love place great atmosphere service food margaritas crazy good try device acapulco best ever quesadillas octopus tostadas ribs plantain chips
51face89498e41b0082ae344;hands best tequila selection glyfada boom
51face89498e41b0082ae344;lunch time place order phone pick take forever order person worth wait
5990934cdd84420428345b93;great place food far better mexican radio across street shredded chicken barrio best city
51face89498e41b0082ae344;food delicious highly recommend ordering corn cob best thing ever
5990934cdd84420428345b93;get contraband chicken really amazing
4fe21ffbe4b0f27f28501755;burgers great theres special one menu called yard burger got really spicy hot jamaica marine sweet potato fries balance plenty water
51face89498e41b0082ae344;must get rear try stones damn good
51face89498e41b0082ae344;pl4 house special
51face89498e41b0082ae344;judge pho places based table chili paste excellent blend
5cb37f88fdb9a7002cdf337d;get grilled pork drawn shrimp vermicelli bowl ask jalapeos top house bowl peanut sauce continent bar sriracha plum sauce stir yum
55de1b6c498eb885f90538d3;get crisp dough really unique delicious take starch eggs
60cb175230cc47201eac2b5d;expect 1520 wait branch totally worth
60cb175230cc47201eac2b5d;potato pancake makes excellent branch side table make mean one
60cb175230cc47201eac2b5d;branch many times already always get crore madame salivating writing
51face89498e41b0082ae344;could come everyday get sick yes good
5803982438fa2d2166a8d529;doublechocolate crumbs cake divine
51face89498e41b0082ae344;everything delicious everything
50688d57e4b08aab60b1cd17;believe hype babycakes makes superior treats favorite browne uptake pumpkin uptake seasonal
5a801d1f82a75057c022c6ef;good expensive johns coffee shop lot glyfada atmosphere signed images news anchors foreign currency wall owner really talkative
51face89498e41b0082ae344;remember cash makes
5cae4c8cb3c961002c6533a9;brought shrimp ticos choice eats corn gorilla salted shrimp chile chipotle garlic avocado slice dummy
5cae4c8cb3c961002c6533a9;ticos far mediocre go queens amazing ticos 13 price good election tequila dine ask yellow habanero sauce dare killer
59c6badc2079556b585d4b2a;mercado margaret extra spicy heavenly
5009a1f1e4b0e95403cfc27b;try pork watermelon salad seriously
51face89498e41b0082ae344;fatty everything buff said best dark stormy city
5bc784a7666116002c1e090d;colors recommended cheap eat ordered chill crab realising would rocket bill worth pork belly watermelon knew tasty
5f91d0d5bd1cc65e69f560e6;cheapest wine 40 please
5f91d0d5bd1cc65e69f560e6;stop pushing place seriously overpriced levels wines apps mains get train go chinatown save 100 two easily
55de1b6c498eb885f90538d3;choice eats attended brought fatty devils devised eggs event handed night delicious
5814f39e38fab7673f30f0e9;check ice teas diff varieties herbs etc
4c866a48dc018cfaae11ef6c;delicious french cuisine equally top quality wines theyre part restaurant week regardless definitely worth price swing 4 4 petals via fond
51face89498e41b0082ae344;best barnaise writes tribe
5bc784a7666116002c1e090d;get oysters theyre great
51face89498e41b0082ae344;beautiful glyfada city classic try alaska porchetta make way list
5bc784a7666116002c1e090d;sandwich nazi order quick efficiently try go split split cant eat 14 inches sandwich saying
51face89498e41b0082ae344;alaska far determined make list
51face89498e41b0082ae344;keep simple matthew foccacia rock world
51face89498e41b0082ae344;ask stuff offend love
50f17d21e4b0e2cb83061005;bamboo sandwich fresh mozarella basil tomatoes dressing semolina best summer url thank
51face89498e41b0082ae344;matthew foccacia best sandwich glyfada
5cb37f88fdb9a7002cdf337d;love bar drinks bartender awesome love little patio cant wait go back
5051ad96e4b09819b92cc135;bit disappointed red lobster honest personally thought ruby tuesday across street round better experience
51face89498e41b0082ae344;cedar biscuits cooked little long
51face89498e41b0082ae344;dont come large parties keep 7 dont want separated
51face89498e41b0082ae344;never go starving wife lmaz impatient
5cb37f88fdb9a7002cdf337d;oh em gene youre reading turn around pick shit leave restaurant immediately total bar
60cb175230cc47201eac2b5d;cash branch good standard little expensive actual building cool views brooklyn bridge excellent definitely good place bring visitor
51face89498e41b0082ae344;best nuevos ranchers ive ever goes well one press drinks look super tall waiter side note fianc proposed retro photo booth
60cb175230cc47201eac2b5d;incredible branch bit price totally worth enjoy view waterfront
51face89498e41b0082ae344;need square cash retarded
60cb175230cc47201eac2b5d;best feelgood branch place brooklyn best biscuitsjam combination love us love yalegurneycomshop
51face89498e41b0082ae344;recommends johnny cakes dont scared ask extra pickle
547605ce498e29745d7d59f5;gray rainy days feel like paris coupled espresso clair almondine
5a801d1f82a75057c022c6ef;great pastries coffee thats basically rocket fuel overlooked item soup made fresh daily delicious bit price 5 cup
4f2d37f9e4b04796490faf48;kalamata olive cream cheese good want something little different
4f2d37f9e4b04796490faf48;whole wheat everything bacon stallion cream cheese
5a801d1f82a75057c022c6ef;great pages weak coffee beware long weekend lines
51face89498e41b0082ae344;favorite sauces
5f6a2cbffbb8d3382339db1e;sweet mango chimney sauce best regular plenty one person finish
51face89498e41b0082ae344;new black shuffle sauce worth cost 175 absolute bliss mouth
51face89498e41b0082ae344;time far rosemary garlic
5f6a2cbffbb8d3382339db1e;shuffle mayo sweet mango chimneys super stars
51face89498e41b0082ae344;try hommes writes spot foodspotting
593c42250457b735c9d9dd02;need get back try sauces fries sweet mango chimney mayo asahi mayo pomegranate teriyaki mayo worth 20 minute wait freezing temps 4 4 petals via fond
593c42250457b735c9d9dd02;try belgian fries oh dear havent ti eaten via foodspotting
51face89498e41b0082ae344;youre fan peanut sauce war sauce must
51face89498e41b0082ae344;get writes table
5bc784a7666116002c1e090d;curry ketchup especial rocks dont want spend dollar regular especial great
51face89498e41b0082ae344;black shuffle mayo know whats good first cup like shot
51face89498e41b0082ae344;black shuffle mayo know whats good first cup like shot
51face89498e41b0082ae344;dip write partisan peppercorn honey mustard bite amazing
4f2d37f9e4b04796490faf48;blue cheese best sauce place thats first one go
51face89498e41b0082ae344;try garlic mayo
51face89498e41b0082ae344;try hommes writes spot foodspotting
51face89498e41b0082ae344;roasted garlic
5f6a2cbffbb8d3382339db1e;get newman sopressata salary sweet italian sausage white pie amazing
4f2d37f9e4b04796490faf48;try tony clinton wild mushrooms sweet red pepper pest italia onions mozzarella cheese go specialty pies ordering
51face89498e41b0082ae344;must really like spicy foods enjoy coleslaw mouth fire
5bc784a7666116002c1e090d;bird great dont get scared whats beast superb
51face89498e41b0082ae344;cleopatra jones rocks
5b6489cd031320002c9ee47a;okay garlic rolls really good pizza
51face89498e41b0082ae344;try
5b6489cd031320002c9ee47a;love love love divine spicy pizza named filthiest drag queen ever sunday dude amazing alternative love place
5c0d852abe7078002cfbc362;beast spicy meat great balance flavor texture
5cb37f88fdb9a7002cdf337d;tapes bar downstairs make left takeoff section
5990934cdd84420428345b93;try tofu chicken pad thai absolutely superb beautiful caramelised peanut pieces atop subtly spaced noodles w bean sprouts nice verso good
51face89498e41b0082ae344;whole menu superb black rice makes dishes better hot sauces left kinda hidden look
51face89498e41b0082ae344;cash otherwise excellent
60cb175230cc47201eac2b5d;try coconut french toast w lime syrup died banana top branch treat
51face89498e41b0082ae344;mustfeels like paris sit counterwatch chef working get know fellow diners definitely returning often
5bc784a7666116002c1e090d;carbonnaras great owners real friendly get practice miserable french owners real patient
5bc784a7666116002c1e090d;atmosphere great seeing
60cb175230cc47201eac2b5d;spend morning branch kid read sunday times drinks smooth colors coloring book
5c0d852abe7078002cfbc362;take full advantage 12 priced meats certain week days yum
51face89498e41b0082ae344;straight forward take shoes
5c0d852abe7078002cfbc362;great food great alliance great weekday happy hour specials meat beer
5bc784a7666116002c1e090d;food crazy good favor eat
5a801d1f82a75057c022c6ef;charge 3 iced coffee menu says 2 chain late another visit undrinkable
5051ad96e4b09819b92cc135;get amazing white porsche soup saturday sunday
5009a1f1e4b0e95403cfc27b;895 lunch special soup salad entrez tea coffee
51face89498e41b0082ae344;expect cheese
51face89498e41b0082ae344;amazing bathrooms like ever seriously wont take better pee glyfada
51face89498e41b0082ae344;bring throwing stars nunchucks
5f4fe6286a74f475f7e99a29;best place take outoftowners also great big groups people enjoy fun drink rin get steakinthebox heaven explode mouth
51face89498e41b0082ae344;bring sword
51face89498e41b0082ae344;use ninja entrance
51face89498e41b0082ae344;probably worst food ive going dinner glyfada theyre attempt entertain via ninja outfits slightly amusing overall wouldnt recommend
51face89498e41b0082ae344;robert best server whole place expect cry laughter awesome food awesome interior ninjas
593c42250457b735c9d9dd02;disco fries make everything better
5693c7bf498eff2f82ca1c4b;slow service 0400 bathroom sticks literally
5bc784a7666116002c1e090d;solid neighborhood 24 hour diner dont bother eating cole law
5693c7bf498eff2f82ca1c4b;didnt know vegan could good
5693c7bf498eff2f82ca1c4b;praise sedan orange blackstrap bb black olive delicious
5693c7bf498eff2f82ca1c4b;give place try banana bread french toast delicious
5693c7bf498eff2f82ca1c4b;try steve roll
5693c7bf498eff2f82ca1c4b;try live california uni season tasty via foodspotting
5693c7bf498eff2f82ca1c4b;usage beautiful nicely filling
58060b33d67c47a958f89339;best sushi lunch special upper east side
50f17d21e4b0e2cb83061005;horizon tico amazing
4f2d37f9e4b04796490faf48;johnnnnyyyyy boy extra cheese dragon fo sho tho
5693c7bf498eff2f82ca1c4b;trans fats angelheaded sisters
5045e3e9e4b0c78b23afd97b;prepared massive portions order ots side revive school cafeteria days
60cb175230cc47201eac2b5d;save tip order one branch side share recommend horizon concave portions huge
50f17d21e4b0e2cb83061005;egg sandwich pest fried tomato bacon best
5bc784a7666116002c1e090d;food took forever great though best pancake super dough
5693c7bf498eff2f82ca1c4b;make sure give josh highfive amazing host
4f2d37f9e4b04796490faf48;mac cheese delist
51eae530498e053b23bd2bd8;way drink beer jar preserves happy hour used dont think ill back sorry
5693c7bf498eff2f82ca1c4b;ginger cookies even better grandmothers sorry gray
5693c7bf498eff2f82ca1c4b;duck pad thai
60cb175230cc47201eac2b5d;best staff branch les
60cb175230cc47201eac2b5d;disappointing especially since amazing branches back everything really blah
4c866a48dc018cfaae11ef6c;get salty dog use fresh grapefruitjuice aliasrestaurant
5693c7bf498eff2f82ca1c4b;service impeccable bring date
5693c7bf498eff2f82ca1c4b;napoleon spectacular
5990934cdd84420428345b93;good lunch service go twice month never bad experience chicken pillars far
5cb37f88fdb9a7002cdf337d;thin crust traditional italian style pie like find lombardis grimaldis tried arugula pie per food networks ted aliens suggestion good sausage best
5b6489cd031320002c9ee47a;best pizza neighborhood wood fire oven thin crust make whatever want 3 4 petals via fond
5b6489cd031320002c9ee47a;try pepperoni olive anchovie roasted red pepper pizza good friday comfort food yum via foodspotting
547605ce498e29745d7d59f5;cant beat eggs potatoes toast 350
4fe21ffbe4b0f27f28501755;thats actually one worse burgers ive pity seem nice lt quite foggy
5f4fe6286a74f475f7e99a29;cheesesteak pretty junk delicious macncheese aint half bad
506f0bece4b0bb95516a6222;almond bubble tea bitter go white swan bakery centre canal good tasting almond tea
5814f39e38fab7673f30f0e9;try taro bubble tea nom via foodspotting
5bc784a7666116002c1e090d;great green milk tea bob tea student discounts available
5693c7bf498eff2f82ca1c4b;show student id discount dont forget cash
5693c7bf498eff2f82ca1c4b;drink orlando rosso
60cb175230cc47201eac2b5d;branch amazing also warship soup spot
5cb37f88fdb9a7002cdf337d;get anything homemade candy bars desert probably shouldnt friends
5c0d852abe7078002cfbc362;real meatballs normally duck breast done
5693c7bf498eff2f82ca1c4b;busted diet
5bc784a7666116002c1e090d;pastry basket required eating
5693c7bf498eff2f82ca1c4b;affection ghits order good
59ab24a79be5225c7ba8c807;food great cocktails either thought perhaps theyre mixing poorly
5693c7bf498eff2f82ca1c4b;try egg scramble caramelized onions apple smoked bacon via foodspotting
5693c7bf498eff2f82ca1c4b;appeared martini delist totally made day
55de1b6c498eb885f90538d3;devised eggs rival grandmasjust delicious
5bc784a7666116002c1e090d;create delicious oyster flight wideranging selection continental sources bc wv wa etc
5693c7bf498eff2f82ca1c4b;make reservation prepared wait long time table
4d7e4efbb25d6dcb1117b742;try desserts best city
5693c7bf498eff2f82ca1c4b;chili sauce blend fantastic definitely add onto rice dish
5693c7bf498eff2f82ca1c4b;pronounced chingdow tsingtao
57116a25498ea9ddf52437b7;awesome pho great service always delicious summer rolls
4c866a48dc018cfaae11ef6c;restaurant participating chinatown restaurant week mar 9 18 look 1888 pp menu
5051ad96e4b09819b92cc135;incredible soup beef order 48 taste vietnamese heaven
5693c7bf498eff2f82ca1c4b;best cappuccino whole city
547605ce498e29745d7d59f5;smoother espresso ive ever
5693c7bf498eff2f82ca1c4b;chain iced warm chain
5a801d1f82a75057c022c6ef;coffee glyfada
5f91d0d5bd1cc65e69f560e6;go understand people run place italian want something get attention people food wine amazing
5bc784a7666116002c1e090d;great food profiterols could better
5693c7bf498eff2f82ca1c4b;everything dummy
5693c7bf498eff2f82ca1c4b;generous portions
5990934cdd84420428345b93;pan fried pork dumping far steamed pork juicy runs dummy sesame chicken everything menu delicious
547605ce498e29745d7d59f5;chateaubriand amazing comes perfectly roasted lingering potatoes die
5693c7bf498eff2f82ca1c4b;pool table free
60cb175230cc47201eac2b5d;grab whiskey work better yet come back sunday mornings live bluegrass branch
5b6489cd031320002c9ee47a;grilled pizza stayed crisp flavorful pork chop great penned nothing special overall fantastic ingredients
5cb37f88fdb9a7002cdf337d;another chill barrestaurant free billiards
5bc784a7666116002c1e090d;come 57 350 money island lager beer great deal
5cb37f88fdb9a7002cdf337d;terrible bar layout poor design servers depressed mean
5f4fe6286a74f475f7e99a29;branch great housed grossed steak eggs granular yogurt bomb live music sunday ragbluegrass real fun def going back 4 4 petals via fond
5693c7bf498eff2f82ca1c4b;get omakase full gary experience
5693c7bf498eff2f82ca1c4b;worth every penny
58060b33d67c47a958f89339;omakase price worth far best sushi experience outside japan
5cb37f88fdb9a7002cdf337d;vegetarian omakase upon request get omakase bar 14 reggae pieces 50 14 seafood pieces 90 friendly service best sushi ive make worth every cent
50f17d21e4b0e2cb83061005;salmon pieces tomato top original must
4fe21ffbe4b0f27f28501755;opinion dont best burger glyfada fancy unique patty perfect thickness theyre always got nice fresh veggies top
4fe21ffbe4b0f27f28501755;best burger glyfada plain simple
4fe21ffbe4b0f27f28501755;indisputable best cheeseburger around roche handcrafted pickles set masterpiece beef nobody better nobody
5990934cdd84420428345b93;fried pickles good also chicken sandwich
5693c7bf498eff2f82ca1c4b;gnis favorite thing years
5693c7bf498eff2f82ca1c4b;cotta nude might one favorite dishes city
593c42250457b735c9d9dd02;shoestring fries yes want
5693c7bf498eff2f82ca1c4b;love coming late night week beer point food finger linking good
4fe21ffbe4b0f27f28501755;blue cheese burger 1 far
4fe21ffbe4b0f27f28501755;oysters devised eggs nude cheeseburger stuffed happy
4fe21ffbe4b0f27f28501755;burger seriously burger
4fe21ffbe4b0f27f28501755;start nude finish burger
5693c7bf498eff2f82ca1c4b;best martini city quite possibly world also miss nude
4d7e4efbb25d6dcb1117b742;dont skip dessert banoffee pie die
4fe21ffbe4b0f27f28501755;favorite burger town devised eggs unreal
5693c7bf498eff2f82ca1c4b;wifi password pigpigpig 3 little pigs
5693c7bf498eff2f82ca1c4b;must visit ny
5693c7bf498eff2f82ca1c4b;sheep cotta nude may incredible thing ever full stop
55de1b6c498eb885f90538d3;devised eggs radio
4f2d37f9e4b04796490faf48;mmm grilled cheese
4fe21ffbe4b0f27f28501755;well done charbroiled burger better mediumrare
4fe21ffbe4b0f27f28501755;order burger best live texas know thing two burgers
5693c7bf498eff2f82ca1c4b;nude die fabulous vegetable plate
5cb37f88fdb9a7002cdf337d;beauty gastropod order tasty snacks bar wellprepared cocktail
4f2d37f9e4b04796490faf48;visit glyfada decided try nice main breakfast food service awesome apparatus goat cheese meet perfect
5bc784a7666116002c1e090d;great food atmosphere top 10 us
5693c7bf498eff2f82ca1c4b;salmon benedict cool
5009a1f1e4b0e95403cfc27b;order mediterranean salad perfect heart lunch
4c866a48dc018cfaae11ef6c;walk around upper west side corner restaurant great breakfast branch late breakfast etc check espresso martini
60cb175230cc47201eac2b5d;branch always fantastic try sitting outside spring incest staff yalegurneycomshop
4fe21ffbe4b0f27f28501755;spicy lamb burger outstanding dont shy ordering branch either
5bc784a7666116002c1e090d;order via app online beat long lunch lines go straight register pick order
5693c7bf498eff2f82ca1c4b;guys deliver across street bolt bus
4f2d37f9e4b04796490faf48;get serrata giant ball goat cheese tomatoes side make want keep eating forever person side afternoon snack
5cb37f88fdb9a7002cdf337d;one faces get seat bar lunch get seat outside nice get couch window youre someone hi
593c42250457b735c9d9dd02;really great place grab piano lunch especially like tuna summers nice sit outside small group 3 4 petals via fond
5693c7bf498eff2f82ca1c4b;remember go check epistrophy 200 st denmark spring glyfada ps added iphone
4f2d37f9e4b04796490faf48;get plate cheese drinks
5f91d0d5bd1cc65e69f560e6;reasonable wine glass selection
5009a1f1e4b0e95403cfc27b;try poll en salad says grilled chicken salads boring herb infused grilled chicken bursting flavor sliced green grapes add touch whilst making perfect
5693c7bf498eff2f82ca1c4b;seen tina feyamy poehler movie
5693c7bf498eff2f82ca1c4b;turkey apple cedar pain ftw
4f2d37f9e4b04796490faf48;best ham cheese pain ive ever thank later
5990934cdd84420428345b93;try pest chicken en mozzarella pain iced tea
5693c7bf498eff2f82ca1c4b;go downstairs lounge sit com coaches
5cb37f88fdb9a7002cdf337d;restaurant upstairs nice bar downstairs great
5b6489cd031320002c9ee47a;copies authentic civilian restaurant ev brickoven pizza bread served hot meal price right
5693c7bf498eff2f82ca1c4b;waiting shelbscoleman
5693c7bf498eff2f82ca1c4b;feeling hungry get sausage latter hofbrau
5a801d1f82a75057c022c6ef;fastest house coffee brooklyn
5693c7bf498eff2f82ca1c4b;beer list good
5bc784a7666116002c1e090d;great place buy find love jersey city tees
5cb37f88fdb9a7002cdf337d;ask spammy bar tip well hes best
51eae530498e053b23bd2bd8;decor awesome short bw film big screen arts paintings wall awesome prices food happy hour sunday fun days
5051ad96e4b09819b92cc135;come lobster stay mural
5051ad96e4b09819b92cc135;amazing lobster
5051ad96e4b09819b92cc135;try lobster spot foodspotting
5051ad96e4b09819b92cc135;get daily double never go wrong two lobster two lobster
5803982438fa2d2166a8d529;amazing milk chocolate
5bc784a7666116002c1e090d;lichen martini sweet sticky rice mango great good
5693c7bf498eff2f82ca1c4b;ganglia spamming peach lichen
5693c7bf498eff2f82ca1c4b;youre choosing red green curry definitely go red premier deeper flavor
5bc784a7666116002c1e090d;cant get cheaper better tasty food great people
5693c7bf498eff2f82ca1c4b;everything good true story
5051ad96e4b09819b92cc135;try cuba soup light meal goes good steamed vega maze rice
5693c7bf498eff2f82ca1c4b;delicious healthy food black sesame pudding nonguilty indulgence
50f17d21e4b0e2cb83061005;get black olive sausage piece loan funnel sausage freshly made tomatoes bright tasting canned olives saline flavors come together delicious
5b6489cd031320002c9ee47a;delicious pizza jalapenos youre welcome bring though
5b6489cd031320002c9ee47a;goooooood staff nice medium pizza right two hungry people first time im new worker birth definitely come back
5b6489cd031320002c9ee47a;oh get basil pizza awesomeness
5693c7bf498eff2f82ca1c4b;beautiful women les come
5bc784a7666116002c1e090d;great space wifi work healthy food
55de1b6c498eb885f90538d3;eggs tasted fresh also breakfast smooth w granular filling tasty
5693c7bf498eff2f82ca1c4b;get chain late almond milk philly day
5693c7bf498eff2f82ca1c4b;turkey delete sandwich excellent
5693c7bf498eff2f82ca1c4b;music hook thursday old school hip hop r b reminds hot 97 back day
5693c7bf498eff2f82ca1c4b;amex check doesnt work accept amex
5693c7bf498eff2f82ca1c4b;salmon spinach guinea delicious healthy
5051ad96e4b09819b92cc135;get tomato soup good entrez
5693c7bf498eff2f82ca1c4b;red means
5009a1f1e4b0e95403cfc27b;1695 lunch special includes salad soup spring roll sushi roll entrez
5b6489cd031320002c9ee47a;like caramelized onion plain pizza chocolate chip cookies good
5b6489cd031320002c9ee47a;damnnnnn pizza sooooooooooo good personal size pizza make order delicious list
5990934cdd84420428345b93;get taiwanese chicken chop rice black milk bubble tea cold summer hot winter
5693c7bf498eff2f82ca1c4b;theyre cashonly arms around outside stop one head taiwanese deliciousness
5814f39e38fab7673f30f0e9;passionfruit black tea delicious
5814f39e38fab7673f30f0e9;pretty good willing travel try kung fu tea 10th 1st
5814f39e38fab7673f30f0e9;best pearl milk tea glyfada try food simple tasty cash though watch
5693c7bf498eff2f82ca1c4b;theyre got taiwanese classics taiwanese pork chop rice holly
5693c7bf498eff2f82ca1c4b;prices raised favorite almond toast 250
5f4fe6286a74f475f7e99a29;chopped steak amazing
5693c7bf498eff2f82ca1c4b;stay away cebiche older waitress kind rude well
5693c7bf498eff2f82ca1c4b;greyhound
5cae4c8cb3c961002c6533a9;try ticos via foodspotting
5bc784a7666116002c1e090d;8 mile high anchor good like 4 miles high great salsa
5cb37f88fdb9a7002cdf337d;food always good service gone downhill long waits place ordersget recalls diluted pitchers mimosas club soda looked embarrassed called
5693c7bf498eff2f82ca1c4b;bathroom awesome
5693c7bf498eff2f82ca1c4b;awesome drinks specials horrible service
5693c7bf498eff2f82ca1c4b;split bottle male surf turf
4b487745f964a520c04d26e3;generous breakfast portions fainthearted
