ID;Comment
5f4fe6286a74f475f7e99a29;dark stormy float
4b16df5bf964a520c0be23e3;winner best reggae burger village voice 2011 best issue bun veggies burger work perfect harmony
4b16df5bf964a520c0be23e3;one best burgers ever im texas much ive heard great things lot items get original burger wont disappointed
4b16df5bf964a520c0be23e3;try bleu cheese bacon burger spot foodspotting
5f4fe6286a74f475f7e99a29;turnaround time order made shake shack look like vending machine
4b16df5bf964a520c0be23e3;cant go wrong lamb kota burger
4b16df5bf964a520c0be23e3;try reggae burger via foodspotting
4b16df5bf964a520c0be23e3;try signature five akin burger excellent try hi tuna burger also excellent
4b16df5bf964a520c0be23e3;sushi extra jalepenos beer burgers bruno oh sit leads section
5009a1f1e4b0e95403cfc27b;hk far cant beat double tuna roll burger salad
4b16df5bf964a520c0be23e3;good authentic burgers milk shakes
4b16df5bf964a520c0be23e3;burger glyfada oh yeah good great local beers
4b16df5bf964a520c0be23e3;get original 5 akin burger onions cheese soon story bread perfect fluffy medium rare way go
4b16df5bf964a520c0be23e3;inside burgerbest lettuce wrap ever great shakes
5f4fe6286a74f475f7e99a29;skip sunday big disappointment
5f4fe6286a74f475f7e99a29;turnaround time order made shake shack look like vending machine
5f4fe6286a74f475f7e99a29;please dont come
5f4fe6286a74f475f7e99a29;really good foodservice awesome
4e3472618877beb5e9a14aa9;best bacon egg cheese universe especially salt babel
5f4fe6286a74f475f7e99a29;worth wait every time
547605ce498e29745d7d59f5;egg white cedar potato everything babel way go babel always fresh
509b7e5de4b03b06dafcf6b2;coffee ice cubes guarantee iced coffee wont get watered perfect weekend walking around downtown long commute
547605ce498e29745d7d59f5;egg cedar potatoes plain weekend go perfect every time
4e3472618877beb5e9a14aa9;little stressful small place warm crowded worth salt pages mmmm
5f4fe6286a74f475f7e99a29;bring anyone youre dating person doesnt think awesome stop dating person
5f4fe6286a74f475f7e99a29;ask lou sugarfree knuckle sandwich
5697f2c2498e7ea36e332f6f;young baby coconut drink deliciousness ask split open eat insides goodbye hangover
5f4fe6286a74f475f7e99a29;definitely get china masala
5697f2c2498e7ea36e332f6f;also great ive better elsewhere otherwise chapatti wrap nice crisp oily recommended
5b6489cd031320002c9ee47a;best pizza montclair one open forester delivering
5051ad96e4b09819b92cc135;soup dumping
5f4fe6286a74f475f7e99a29;words crisp roll
5f4fe6286a74f475f7e99a29;spicy rock shrimp temporal crisp rice homage
5f4fe6286a74f475f7e99a29;black dynamite roll damn right
5f4fe6286a74f475f7e99a29;spinach pie musthave shiny crack layers filo dough rammed full carefully seasoned pure spinach ousted dried herbs taste strongly organ
5f4fe6286a74f475f7e99a29;village voice voted best spinach pie best glyfada poll
5009a1f1e4b0e95403cfc27b;spaced pork sandwich great fresh salads
5009a1f1e4b0e95403cfc27b;fear mornings sell blueberry scores salads soup excellent
5697f2c2498e7ea36e332f6f;great delicious food awesome hot actresses tip well deserve
4b487745f964a520c04d26e3;breakfast specials huge serving
5f4fe6286a74f475f7e99a29;anything shuffle vinaigrette
58060b33d67c47a958f89339;make sure tip blonde asian well deserves
5f4fe6286a74f475f7e99a29;grab favorite magazine go sit front window glass hermitage read
51eae530498e053b23bd2bd8;daily 2for1 happy hour beer wine sake 48 cant beat
5c0d852abe7078002cfbc362;youre feeling like small bites meatballs spinach artichoke dip maybe charcuterie cheese board
5f91d0d5bd1cc65e69f560e6;come late night enjoy glass wine short rib spiders kitchen open late
50688d57e4b08aab60b1cd17;come breakfast try freshly baked croissant like ham cheese
5051ad96e4b09819b92cc135;french onion soup pretty good
59ab24a79be5225c7ba8c807;oro champagne cocktail delicious amazing branded cherries bottom
5f4fe6286a74f475f7e99a29;grab lunch late sit window talk shit people particularly friends cant believe im first leave tip considering appears popular activity
5051ad96e4b09819b92cc135;spicy noodle soup
5697f2c2498e7ea36e332f6f;hit hit partners spade next block well great one
5990934cdd84420428345b93;cant go wrong roast beef sandwich pickles come amazing
5990934cdd84420428345b93;harass honeyroasted chicken sandwich may favorite sandwich glyfada could eat every day
5f4fe6286a74f475f7e99a29;guys conceived brilliant idea adding coconut milk steelcut oatmeal delicious
5f4fe6286a74f475f7e99a29;mix match
5990934cdd84420428345b93;told get roast beef sandwich told right get roast beef sandwich great
5990934cdd84420428345b93;roast beef sandwich pretty much version lunch heaven
4f2d37f9e4b04796490faf48;grilled cheese special cedar caramelized onions tomato jam battery white bread delicious
5697f2c2498e7ea36e332f6f;go eat shop explore
5697f2c2498e7ea36e332f6f;great fare kind staff copy atmosphere
5990934cdd84420428345b93;easy miss great spot lunch lots charm character roast beef horseradish excellent ill back 3 4 petals via fond
5f4fe6286a74f475f7e99a29;saturday afternoon didnt want leave copy classic oldies stereo
5cb37f88fdb9a7002cdf337d;youre coffee tea fan make mean espresso style hot cocoa bar
5f4fe6286a74f475f7e99a29;order lemonade enjoy
4f2d37f9e4b04796490faf48;start goat cheese mussels dinner chicken excellent
53c5c014498e6f81099df055;great breakfast egg sandwich croissant greek yogurt
5f4fe6286a74f475f7e99a29;try madeleines
5f4fe6286a74f475f7e99a29;try crore madame
509b7e5de4b03b06dafcf6b2;great coffee 3 4 petals via fond
5f4fe6286a74f475f7e99a29;get tempuraudon combo still wake middle night rolling
5f4fe6286a74f475f7e99a29;make curry set
5f4fe6286a74f475f7e99a29;addicted negitoro set
5f4fe6286a74f475f7e99a29;weekday bet 5 theres dude center table laptop perched little stand playing computer games pay suck
5f6a2cbffbb8d3382339db1e;summer pro tip half lemonade half green tea sweetened key right amount sweet comes lemonade look refreshing looks
5f4fe6286a74f475f7e99a29;many dumps taken day
5f4fe6286a74f475f7e99a29;best public restroom blocks
5f4fe6286a74f475f7e99a29;big big smile always better service
5f4fe6286a74f475f7e99a29;peppermint late non fat bueno
5697f2c2498e7ea36e332f6f;always crazy nuts organized often fast bad half seating taken people whose bought nothing
5f4fe6286a74f475f7e99a29;say thank vote
5f4fe6286a74f475f7e99a29;worker jackasses unfriendly shocks
5f4fe6286a74f475f7e99a29;clear get want shocks
5803982438fa2d2166a8d529;get cake batter chocolate twist soft serve
57c483a3498e92027392c487;one best places lacrosse intolerant friends love ice cream
57c483a3498e92027392c487;best ice cream city possibly
4c866a48dc018cfaae11ef6c;crazy skin thick dumping flat flavorful go two blocks sweet spring restaurant pay 50 cents 100x better dumping
5f4fe6286a74f475f7e99a29;others stated five dumping 1 2 need get
5990934cdd84420428345b93;ordered vegetarian latter go choked chicken bone
5697f2c2498e7ea36e332f6f;spicy enough taste definitely one affordable options curry hill area go combo latter grab seat upstairs
5f4fe6286a74f475f7e99a29;good price nothing special get mixed latter single dish servers got good stories mine bombay
5803982438fa2d2166a8d529;hot chocolate good try almond croissants well
50688d57e4b08aab60b1cd17;almond croissant unspeakably delicious
5697f2c2498e7ea36e332f6f;almond french toast one amazing things ever eat
4d7e4efbb25d6dcb1117b742;try magellan dessert chocolate mouse gingerbread encased chic dark chocolate go wrong
5697f2c2498e7ea36e332f6f;best croissant ive glyfada far great flak texture bitterness
5f4fe6286a74f475f7e99a29;get 10 course omakase chefs recommendations
5f4fe6286a74f475f7e99a29;try grilled steak amazing love 80s90s music play
5f4fe6286a74f475f7e99a29;shrimp remoulade sandwich delist
5f4fe6286a74f475f7e99a29;becoming top spot work ac brr tho
5f4fe6286a74f475f7e99a29;peanut butter smooth point
5990934cdd84420428345b93;chicken tina delicious
5009a1f1e4b0e95403cfc27b;recommend shanghai chicken salad
50f17d21e4b0e2cb83061005;tico madness monday great deal
50f17d21e4b0e2cb83061005;tico madness monday amazingness
5697f2c2498e7ea36e332f6f;chips salsa great rest menu terrible drinks weak service worse
60cb175230cc47201eac2b5d;one best acd branches city make reservations order lobster benedict
5051ad96e4b09819b92cc135;lobster mac die
60cb175230cc47201eac2b5d;dont come 56 wind u want eat dont serve branch dinner transition fail
5f4fe6286a74f475f7e99a29;skip place dinnermediocre food
5697f2c2498e7ea36e332f6f;drinks 3 wait get seated genius
5f4fe6286a74f475f7e99a29;place use amazing got new chef changed menu food sucks
4f2d37f9e4b04796490faf48;lobster macncheese yum
5cb37f88fdb9a7002cdf337d;crisp pork belly take half way heaven lobster mac cheese finish job ask fun bartender recommendations try something little weird till great
50688d57e4b08aab60b1cd17;almond croissant criminally delicious
5f4fe6286a74f475f7e99a29;try assorted macaroons via foodspotting
506f0bece4b0bb95516a6222;theres like good french bakery stuff
5f4fe6286a74f475f7e99a29;get one flavor mouthwateringly delicious macaroons
5f4fe6286a74f475f7e99a29;delicious exotic flavors fantastic
5f4fe6286a74f475f7e99a29;price melt mouth delicious
5f4fe6286a74f475f7e99a29;tres leaves cake via tony
50688d57e4b08aab60b1cd17;butter lane cupcakes get blueberry cream cheese fronting yellow uptake
50688d57e4b08aab60b1cd17;maybe caught day found uptake icing way sweet sponge dry side blah
5f4fe6286a74f475f7e99a29;get closing give dozens pennies
5f4fe6286a74f475f7e99a29;halfoff taste 7th street scoop st wwwscoopst
5c0d852abe7078002cfbc362;flesh style beer beef stew chicken stew bacon mushrooms homemade meatballs marina sauce belgian chocolate mouse belgian baffled featured dishes choice eats
57c483a3498e92027392c487;great place sit chat coffee go dessert get banana split baffled bananas fresh chocolate syrup vanilla ice cream delicious
4f2d37f9e4b04796490faf48;try omelette goat cheese apparatus tomato french via foodspotting
55de1b6c498eb885f90538d3;got try eggs benedict smoked salmon normally goto saturday breakfast
5f4fe6286a74f475f7e99a29;2 smoother 11912 find online go 3 4 petals via fond
5f4fe6286a74f475f7e99a29;switch anniversary estimate blends lot need little variety
5f4fe6286a74f475f7e99a29;say thank vote
5f4fe6286a74f475f7e99a29;love lower level
5b6489cd031320002c9ee47a;come pizza service
50f17d21e4b0e2cb83061005;get fresh mozzarella slice thick slices firm moz follows basilladen tomato sauce top crisp chew crust one best slices city
5b6489cd031320002c9ee47a;fresh mozzarella pizza die
5697f2c2498e7ea36e332f6f;nice crust open air seating catch nice breeze
51eae530498e053b23bd2bd8;great happy hour specials good food well
5697f2c2498e7ea36e332f6f;staff best food drinks great prices simply best
5f4fe6286a74f475f7e99a29;appears prices gone sandwich sizes gone still delicious though
5697f2c2498e7ea36e332f6f;add sriracha spicy rooster death
5f4fe6286a74f475f7e99a29;vignette vegetarian sandwich excellent get spicy thai cities proper experience
58060b33d67c47a958f89339;got grilled pork sandwich thought fusion style compared sandwich places ive loved
58060b33d67c47a958f89339;asian sandwiches sloppy bao medium spice hot
5f6a2cbffbb8d3382339db1e;everything clean fresh wait staff seemed sweet classic sandwich bit acquired taste everything else sounded terrific though
5f4fe6286a74f475f7e99a29;get thai ice coffffffeeeeee
5697f2c2498e7ea36e332f6f;reggae bao tasty treat ask extra pickled carrots
5f4fe6286a74f475f7e99a29;staff cheerful efficient makes times square wearable
5f4fe6286a74f475f7e99a29;say thank vote
5697f2c2498e7ea36e332f6f;big get busy nowhere near bad micro seamless sb much bigger lines 43rd street way
5f4fe6286a74f475f7e99a29;spot way small find another shocks near
509b7e5de4b03b06dafcf6b2;watch people drinking coffee shocks
5051ad96e4b09819b92cc135;dont even like tomato soup tomato cedar one best things ive ever tasted
5051ad96e4b09819b92cc135;keep coming place sup overpriced soupspot 31 bw 7 8
5051ad96e4b09819b92cc135;went today tried 3 different soups still sucks
5051ad96e4b09819b92cc135;ive passed place many times bus sit open public space front decided stop soup 10pm first time still bad idea
5f4fe6286a74f475f7e99a29;service consistently impersonal also food makes roast pork string beans favorite dish
5f4fe6286a74f475f7e99a29;love place lunch dinner fashion week
4b16df5bf964a520c0be23e3;reggae mediterranean chick pea burger kinda bland create mexican black bean burger instead
55de1b6c498eb885f90538d3;dont like eggs soft tell coconut macaroons excellent
5f4fe6286a74f475f7e99a29;cotta starting figs honey questions
5f4fe6286a74f475f7e99a29;good place take date want things quiet cute definitely romantic
4f2d37f9e4b04796490faf48;mac n cheese delicious one best
5f4fe6286a74f475f7e99a29;iron goddess mercy oblong name like
5697f2c2498e7ea36e332f6f;iced pineapple rooibos great hot day east east always good hot day
59c6badc2079556b585d4b2a;green tea margaret amazeballs
5f4fe6286a74f475f7e99a29;
509b7e5de4b03b06dafcf6b2;amazing place spend time reading book group friends big fan coffee soups friendly staff good alliance
5009a1f1e4b0e95403cfc27b;absolutely obsessed baked potato soup bb chopped salad
5f4fe6286a74f475f7e99a29;home
5f4fe6286a74f475f7e99a29;power tv used go time never line
5f4fe6286a74f475f7e99a29;good dannymacaroons
5f4fe6286a74f475f7e99a29;dont go paris find good macron go
5f4fe6286a74f475f7e99a29;avoid lunch time rush drop 3 cappuccino maroon paris favorite sandwich
5f4fe6286a74f475f7e99a29;iced brew best area
5697f2c2498e7ea36e332f6f;espresso perfect great pairing novella maroon
4b487745f964a520c04d26e3;breakfast barrio delist free wifi
5f4fe6286a74f475f7e99a29;im big cappuccinos always get one
5cb37f88fdb9a7002cdf337d;amazing ok depending whos working much love barnstar gods able bestow upon muffin indeed great gotta check place real williamsburg vibe
5f4fe6286a74f475f7e99a29;small die hard regulars ignore hip seems check bench front
5697f2c2498e7ea36e332f6f;get almond croissant soy late best pairing nice morning treat
509b7e5de4b03b06dafcf6b2;try french press coffee added splash half half via foodspotting
5f6a2cbffbb8d3382339db1e;best cheese glyfada ya hit right time mmm great muffin yo come chill w legit hipstamatics ya wont let
509b7e5de4b03b06dafcf6b2;great coffee delicious muffin free wifi love coming want coffee school work
4b487745f964a520c04d26e3;lpg terrific breakfast large community tables lots room spread meetings accountants clients colleagues real find
5f4fe6286a74f475f7e99a29;didnt realize close office
509b7e5de4b03b06dafcf6b2;normally love lps really disappointed weak coffee complained asked another pot told ok fail 2 4 petals via fond
4f2d37f9e4b04796490faf48;love eli stop least twice week way homesuperb selection welleverything love cheeses often go 91st well closer home
57c483a3498e92027392c487;summer ice creamneed say cant decidesample top three
5f4fe6286a74f475f7e99a29;favorite place food shop ever ever ever extremely price well worth youre shamelessfoodie like
5814f39e38fab7673f30f0e9;thai iced tea must
4c866a48dc018cfaae11ef6c;favorite restaurant glyfada far dish basil minded pork trout fish thai iced tea
5697f2c2498e7ea36e332f6f;funnel week risotto must crowd greatest enjoyed looking boring guys trying pickup equally boring girls good place glyfada people watching
5f4fe6286a74f475f7e99a29;actually service sucks time sitting 20 minutes service found
5f4fe6286a74f475f7e99a29;every time im glyfada stop place homemade gua delicious try pitcher ganglia
5f4fe6286a74f475f7e99a29;mama anchor scoop taste midyoem
5803982438fa2d2166a8d529;chocolate milk shake get one
55de1b6c498eb885f90538d3;theyre menu make eggs benedict
5990934cdd84420428345b93;love soy garlic original chicken sometimes grave
5f4fe6286a74f475f7e99a29;pumpkin whoop pies must
509b7e5de4b03b06dafcf6b2;get iced coffee coffee ice cubes amazing
5803982438fa2d2166a8d529;try chocolate
5803982438fa2d2166a8d529;chocolate shakes incredible
5f4fe6286a74f475f7e99a29;peanut curry sticky rice good
5009a1f1e4b0e95403cfc27b;awesome hammond trio friday avoid lab gai chicken salad food overall far authentic tasty though
5f4fe6286a74f475f7e99a29;try
5697f2c2498e7ea36e332f6f;huge piece glass found food like said place sucks lucky none us got hurt eating
5f4fe6286a74f475f7e99a29;place sucks
51eae530498e053b23bd2bd8;great 3 happy hour everything menu 3 bucks
57c483a3498e92027392c487;cute sundaymorning coffee cafe love house blend also belgian baffled fruit delicious yes service little slow relaxed atmosphere sit sip rush
5f4fe6286a74f475f7e99a29;completely understated make sure time
58060b33d67c47a958f89339;skip sushi get bb duck
5f4fe6286a74f475f7e99a29;new drink
5f4fe6286a74f475f7e99a29;also
5f4fe6286a74f475f7e99a29;delicious chips
509b7e5de4b03b06dafcf6b2;coffee weak food looked vandalizing
509b7e5de4b03b06dafcf6b2;try iced american instead starbucks iced coffee like
5f4fe6286a74f475f7e99a29;try turkey lt ged
5f4fe6286a74f475f7e99a29;chain last bomb
5f4fe6286a74f475f7e99a29;try limonana mint tart refreshing delicious via foodspotting
5697f2c2498e7ea36e332f6f;jasmine tea great
5f4fe6286a74f475f7e99a29;reliable free wifi tables usually available probably shouldnt tell anybody
58060b33d67c47a958f89339;wifi grilled gray done
4c866a48dc018cfaae11ef6c;village voice excited zu raven 2012 choiceeats food fest full list restaurants
5990934cdd84420428345b93;guys brought raised beef tongue u201ja liang menu201d szechuan pepper oil cilantro peanut crisp choice eats try
5f4fe6286a74f475f7e99a29;try pork runs eel runs
5f4fe6286a74f475f7e99a29;mini pork runs quite tasty good snack beers
5990934cdd84420428345b93;get beef curry noodle make sure stir use spoon slump bottom dummy surprises
5f4fe6286a74f475f7e99a29;watch step u walk u dont bust ur ass front hooked like
59c6badc2079556b585d4b2a;u french kiss east las pamachambord malaria u like wild fun party 4get u night para pomegranate blue margaret u oxo best wishes courtney
547605ce498e29745d7d59f5;best late american glyfada
509b7e5de4b03b06dafcf6b2;potentially best coffee glyfada
5f4fe6286a74f475f7e99a29;serious drinks beans custom roast intelligentsia old school go cup lies
547605ce498e29745d7d59f5;middle chelsea market usually never find place sit youre walking excellent place stop espresso
5f4fe6286a74f475f7e99a29;ok real cappuccino trust im italian
509b7e5de4b03b06dafcf6b2;girls wearing hats make good coffee
5f4fe6286a74f475f7e99a29;get cappuchino awesome trust
509b7e5de4b03b06dafcf6b2;cold brew coffee told
5f4fe6286a74f475f7e99a29;friendly staff
509b7e5de4b03b06dafcf6b2;iced coffee delicious
547605ce498e29745d7d59f5;im ninth st espresso
509b7e5de4b03b06dafcf6b2;good espresso dont expect italylike coffee anywhere glyfada
547605ce498e29745d7d59f5;amazing espresso took advice ditched take away cup real espresso cup awesome
509b7e5de4b03b06dafcf6b2;im italianthe espresso tastes like turkish coffeeargh
51eae530498e053b23bd2bd8;35 may 615 happy hour frappucinos half price
593c42250457b735c9d9dd02;get spicy tuna crossing calamari avoid halflobster
58060b33d67c47a958f89339;lovely copy spot get pork belly lamb bolognese raven
547605ce498e29745d7d59f5;sea urchin potato grating mindblowing
58060b33d67c47a958f89339;drinks excellent though service slowmotion food tasty bit price
5c0d852abe7078002cfbc362;flesh style beer beef stew chicken stew bacon mushrooms homemade meatballs marina sauce belgian chocolate mouse belgian wales featured dishes choice eats
58060b33d67c47a958f89339;grand mere mussels best
5697f2c2498e7ea36e332f6f;go petite belle wednesday night allyoucaneat mussels
57c483a3498e92027392c487;mmmm wales
5697f2c2498e7ea36e332f6f;love staff remember ur name hate one person ask 4 ur order repeat cashier sometimes gh
58060b33d67c47a958f89339;say thank vote
58060b33d67c47a958f89339;smallest shocks ever best one frequent
5697f2c2498e7ea36e332f6f;good best relate ive italy easily accessible ingredients fresh seasonal im eating relate everything around goes away
5697f2c2498e7ea36e332f6f;fantastic choice food drink great breakfast
5009a1f1e4b0e95403cfc27b;get people line soups salads dont fooled theres almost never long wait
57116a25498ea9ddf52437b7;quick breakfast grab couple spring rolls iced coffee coffee actually cafe du monde new orleans brewed vietnamesestyle poured ice condensed milk
58060b33d67c47a958f89339;cup water 50 cents ice 25 cents without recalls free
58060b33d67c47a958f89339;believe hype band mi damn good avocado shake dummy
58060b33d67c47a958f89339;page song
5b6489cd031320002c9ee47a;pizza great quite possibly best affogato glyfada great service
5b6489cd031320002c9ee47a;best italian place ive glyfada great sopressata pizza
60cb175230cc47201eac2b5d;nova al porno two eggs mozzarella tomato sauce baked perfection little bowl branch heaven
58060b33d67c47a958f89339;kid loves place
58060b33d67c47a958f89339;good indian food
58060b33d67c47a958f89339;god love place
58060b33d67c47a958f89339;ignore rumors 25 food poisoning food simple straight forward tasty restrictive hours
5990934cdd84420428345b93;chicken fried chicken
58060b33d67c47a958f89339;want learn beer ask andy guy knows shit
60cb175230cc47201eac2b5d;life amazing stop branch weekends pancake phenomenal theres lots going evening check great selection craft beers
58060b33d67c47a958f89339;get stew plenty bottle male side
5cb37f88fdb9a7002cdf337d;order cares salad one best glyfada oh make friends daniel bartender hes good man
5b6489cd031320002c9ee47a;surprisingly good pizza deli cheap hell large pepperoni 1387
58060b33d67c47a958f89339;nothing macaroons ridiculously good especially salted cartel
58060b33d67c47a958f89339;plug veg enjoy one favorite tribe spots
58060b33d67c47a958f89339;realized guys got c sanitary inspection sounds like wont visiting
5051ad96e4b09819b92cc135;must try mixtape signature sandwich soup yogurt dipping sauce great
58060b33d67c47a958f89339;bent special try little everything good price
58060b33d67c47a958f89339;pho good
58060b33d67c47a958f89339;best sushi bk far dont miss tnt lover roll
58060b33d67c47a958f89339;best sushi neighborhood contest
58060b33d67c47a958f89339;kis lunch specials went
58060b33d67c47a958f89339;check bobby ber home two doors south crosby
58060b33d67c47a958f89339;check bobby ber home next door 59 crosby seen https design star
58060b33d67c47a958f89339;big big smile always better service
58060b33d67c47a958f89339;say thank vote
5814f39e38fab7673f30f0e9;crew nice disappointed gave wrong size instead making new one poured grande vent cup added milk really killed
58060b33d67c47a958f89339;actually one nicer copy shocks around
5697f2c2498e7ea36e332f6f;treats trucks peanut butter sandwich cookie basically peanut butter butter sugar perfection
5045e3e9e4b0c78b23afd97b;creep cafe au last perfect snack cold winter night
58060b33d67c47a958f89339;get ichi gordon bibimbob spicy delicious
5051ad96e4b09819b92cc135;try ox bone soup ox knee lots collagen
58060b33d67c47a958f89339;kai jim really breaking good shit place get popular get early anything super late night prepared stay line forever
58060b33d67c47a958f89339;730pm monday packed door also doengjang china super spicy like way
58060b33d67c47a958f89339;music awesome friday night
59c6badc2079556b585d4b2a;worst margaret ive looking forward music
58060b33d67c47a958f89339;empanadas amazing white ganglia win
58060b33d67c47a958f89339;awesome food fun music
58060b33d67c47a958f89339;must try spicy pickles
58060b33d67c47a958f89339;extremely terrible service tourist trap took us 20 minutes get water
5c0d852abe7078002cfbc362;try bison meat matter still juicy delicious also august cookie month get cookies
58060b33d67c47a958f89339;spotted chef jeangeorges lunch jeangeorges today coincidence think exciting
58060b33d67c47a958f89339;everything overly grease
58060b33d67c47a958f89339;file die
58060b33d67c47a958f89339;nice bald guy kicks ass
58060b33d67c47a958f89339;winner best serbian village voice 2011 best issue
4c866a48dc018cfaae11ef6c;village voice excited banana 2012 choiceeats food fest full list restaurants
5990934cdd84420428345b93;chicken souvlaki latter awesome
5697f2c2498e7ea36e332f6f;always great service excellent food complimentary mints cookies leave theyre register try boiled jersey pork chops fyi free delivery
5697f2c2498e7ea36e332f6f;croissants battery good flake like mad eat make sure youre wearing nice clothes chow
5f91d0d5bd1cc65e69f560e6;glass wine 10 give little bit almost asked get 10 delicious liquid gold darjeeling however awesome2 mini pot
4d7e4efbb25d6dcb1117b742;chef works magic w texture try dumping w crunch grapefruit config shuffled strawberries also one far desserts city
57c483a3498e92027392c487;get swallows dont skip dessert shuffled strawberries black pepper ice cream
58060b33d67c47a958f89339;prefect blend theme numeric super tiny consider making reservations unless passing delicious
5c0d852abe7078002cfbc362;handpulled noodles right elastic feel get mutton one favorite types meat
5051ad96e4b09819b92cc135;get 2 spicy beef noodle soup youre really hungry order dumping waitress booming voice
5cb37f88fdb9a7002cdf337d;oysters fresh tasty love live swallows boost sushi bar chefs masters
58060b33d67c47a958f89339;blue fin toro baby
5990934cdd84420428345b93;get either 7 beef lemongrass 1 house special order
5697f2c2498e7ea36e332f6f;1 classic great im love special pt sandwich also great drinks choose salty lemon soda basil seed drink
509b7e5de4b03b06dafcf6b2;great iced coffee
5f6a2cbffbb8d3382339db1e;try mango peach ganglia delicious sweet
5990934cdd84420428345b93;official duties black man im stating record korean make best fried chicken
